source_id	status	title	creator_or_org	source_type	url_or_path	accessed_date	cutoff_relevance	primary_or_secondary	used_in	notes
S-0079	available_text_render	Introducing ChatGPT Enterprise	OpenAI	product post	https://openai.com/index/introducing-chatgpt-enterprise/	2026-05-25	pre-cutoff ChatGPT product-evolution source	primary	manuscript/07-chatgpt-enterprise-quote-safe-rows.md	SNAP-20260525-026 captures a local r.jina.ai text-render of the official OpenAI product post after direct shell HTML remained blocked. Use for short OpenAI-attributed original-post feature wording, the Fortune 500 registered-account statement with corporate-domain footnote, and vendor-hosted customer quote context; do not promote paid Enterprise adoption, neutral named-customer deployment, or productivity outcomes without customer-side/independent corroboration.
S-0080	available	Arena Leaderboard Dataset	lmarena-ai	Hugging Face historical dataset	https://huggingface.co/datasets/lmarena-ai/leaderboard-dataset	2026-05-25	pre-cutoff historical text-style-control leaderboard rows published 2026-05-19	primary	manuscript/13-model-rankings-appendix.md	Use the captured text_style_control/latest/overall rows as a clean pre-cutoff leaderboard dataset; label charts as 2026-05-19 historical dataset rows, not as a live May 24 screenshot.
S-0081	available	Mistral AI Pricing	Mistral AI	pricing page	https://mistral.ai/pricing	2026-05-25	post-cutoff access to official Mistral pricing page; not cutoff-day price evidence	primary	manuscript/13-model-rankings-appendix.md	HTML captured in SNAP-20260525-011; pair with S-0063 model docs for Mistral rows, but keep post-cutoff capture and model-version caveats before charting.
S-0082	available	Mistral Docs Pricing	Mistral AI	pricing documentation	https://docs.mistral.ai/deployment/laplateforme/pricing/	2026-05-25	post-cutoff access to official Mistral docs pricing alias; duplicate captured content	primary	manuscript/13-model-rankings-appendix.md	HTML captured in SNAP-20260525-012 with same hash as S-0081; use as official-docs alias and provenance backstop, not as independent cutoff corroboration.
S-0083	available	Energy and AI	International Energy Agency	report	https://www.iea.org/reports/energy-and-ai	2026-05-25	pre-cutoff 2025 global energy/AI report	primary	manuscript/16-datacenters-power-cooling-source-pack.md	Use for global data-center electricity demand, local grid bottlenecks, supply mix, and uncertainty ranges; cite as IEA 2025 and label forecasts as forecasts.
S-0084	available	2024 United States Data Center Energy Usage Report	Lawrence Berkeley National Laboratory	report	https://eta.lbl.gov/publications/2024-lbnl-data-center-energy-usage-report	2026-05-25	pre-cutoff 2024 U.S. data-center electricity report	primary	manuscript/16-datacenters-power-cooling-source-pack.md	Use for U.S. historical electricity use and 2028 scenarios; pair with DOE release for public summary language.
S-0085	available	DOE Releases New Report Evaluating Increase in Electricity Demand from Data Centers	U.S. Department of Energy	press release	https://www.energy.gov/articles/doe-releases-new-report-evaluating-increase-electricity-demand-data-centers	2026-05-25	pre-cutoff DOE summary of LBNL report	primary	manuscript/16-datacenters-power-cooling-source-pack.md	Use for DOE framing and summary figures: 176 TWh in 2023 and 325-580 TWh by 2028; still prefer S-0084 for report-level detail.
S-0086	available	Powering Intelligence: Analyzing Artificial Intelligence and Data Center Energy Consumption	Electric Power Research Institute	white paper	https://restservice.epri.com/publicdownload/000000003002028905/0/Product	2026-05-25	pre-cutoff May 2024 utility/data-center planning report	primary	manuscript/16-datacenters-power-cooling-source-pack.md	Use for scenario framing, local concentration, connection lead times, and utility coordination caveats; do not treat ChatGPT-query energy estimates as final without triangulation.
S-0087	available	Recommendations on Powering Artificial Intelligence and Data Center Infrastructure	U.S. Secretary of Energy Advisory Board	report	https://www.energy.gov/sites/default/files/2024-08/Powering%20AI%20and%20Data%20Center%20Infrastructure%20Recommendations%20July%202024.pdf	2026-05-25	pre-cutoff July 2024 DOE advisory report	primary	manuscript/16-datacenters-power-cooling-source-pack.md	Use for hyperscale interconnection requests, grid bottlenecks, flexibility, backup-power, generation, storage, and transmission recommendations.
S-0088	available	Uptime Institute Global Data Center Survey 2025	Uptime Institute	industry survey	https://intelligence.uptimeinstitute.com/index.php/resource/uptime-institute-global-data-center-survey-2025	2026-05-25	pre-cutoff July 2025 operator survey	secondary	manuscript/16-datacenters-power-cooling-source-pack.md	Use as industry/operator signal for PUE plateau, rising rack densities, worsening power constraints, and cooling barriers; corroborate technical claims with DOE/LBNL/IEA/EPRI where possible.
S-0089	available	ChatGPT Release Notes	OpenAI Help Center	release notes	https://help.openai.com/en/articles/6825453-chatgpt-release-notes	2026-05-25	mutable official release-note page containing pre-cutoff ChatGPT chronology	primary official alternate	manuscript/07-chatgpt-interface-event.md	SNAP-20260525-014 captured a text-render version; use the August 28, 2023 Enterprise release-note entry for launch date and feature wording, while treating later mutable entries as out of scope unless separately cutoff-filtered.
S-0090	available	What is ChatGPT Plus?	OpenAI Help Center	help article	https://help.openai.com/en/articles/6950777-what-is-chatgpt-plus	2026-05-25	mutable official help article with an as-of February 13, 2026 notice	primary official alternate	manuscript/07-chatgpt-interface-event.md	SNAP-20260525-015 captured a text-render version; use only for current Plus plan description and pricing within the cutoff, not as the original February 2023 launch source.
S-0091	available	ChatGPT sets record for fastest-growing user base - analyst note	Reuters	wire article	https://www.reuters.com/technology/chatgpt-sets-record-fastest-growing-user-base-analyst-note-2023-02-01/	2026-05-25	pre-cutoff Reuters report on UBS/Similarweb ChatGPT adoption estimates	secondary	data/chatgpt_adoption_reception_sources_i0056.tsv	SNAP-20260525-017 captured an archive of the Reuters article; candidate for 100M January 2023 MAU and fastest-growing consumer-app reporting, but UBS/Similarweb source-chain and metric-scope normalization remain required before prose use.
S-0092	available_with_app_shell_caveat	Sam Altman X post: ChatGPT crossed one million users	Sam Altman	X/social post	https://twitter.com/sama/status/1599668808285028353	2026-05-25	pre-cutoff personal-primary adoption milestone lead	personal primary	data/chatgpt_adoption_count_audit_i0067.tsv	SNAP-20260525-018 is an X app-shell capture whose embedded JSON exposes full_text and created_at for the Dec. 5, 2022 one-million-users post; quote only the short primary wording with app-shell caveat and do not treat "users" as MAU, registered users, or unique visitors.
S-0093	available_revision_extracted	Policy: Generative AI (e.g., ChatGPT) is banned	Meta Stack Overflow	institutional policy	https://meta.stackoverflow.com/questions/421831/policy-generative-ai-e-g-chatgpt-is-banned	2026-05-25	pre-cutoff developer-community reception policy with later edits	primary institutional	manuscript/07-stackoverflow-ai-policy-quote-precision.md	SNAP-20260525-020 captures the mutable current policy page; SNAP-20260525-027 and SNAP-20260525-028 capture revisions pages; SNAP-20260525-029 captures raw revision 1 source. Use revision 1 for original Dec. 5, 2022 temporary ChatGPT-generated-posts wording and current page only for later/current broader generative-AI policy language with mutable-page caveat.
S-0094	available	NYC education department blocks ChatGPT on school devices, networks	Chalkbeat	New York education reporting	https://www.chalkbeat.org/newyork/2023/1/3/23537987/nyc-schools-ban-chatgpt-writing-artificial-intelligence/	2026-05-25	pre-cutoff education reception reporting	secondary	data/chatgpt_adoption_reception_sources_i0056.tsv	SNAP-20260525-021 captured the Chalkbeat article; use only with attribution to NYC schools/Chalkbeat and do not generalize to all schools or public reception without additional sources.
S-0095	available	ChatGPT crosses 1 million users five days after launch	Tech Startups	technology news article with embedded X post	https://techstartups.com/staging/2022/12/05/chatgpt-crosses-1-million-users-five-days-launch/	2026-05-25	pre-cutoff secondary embed of Sam Altman one-million-user post	secondary	data/chatgpt_adoption_reception_snapshots_i0061.tsv	SNAP-20260525-019 is a readable local capture of a secondary article embedding the Altman X post; use as fallback evidence only, not as a replacement for primary X/archive capture.
S-0096	available	ChatGPT banned by Seattle schools - for now	Axios Seattle	local news article	https://www.axios.com/local/seattle/2023/01/24/chatgpt-banned-seattle-schools-artificial-intelligence	2026-05-25	pre-cutoff education reception reporting	secondary	data/chatgpt_reception_axios_snapshots_i0071.tsv	SNAP-20260525-022 records a local text-render snapshot from the web reader; use only as one named Seattle Public Schools education access-control example with Axios attribution, not as proof of national school panic or a permanent ban.
S-0097	available	JPMorgan restricts staff from using ChatGPT	Axios	workplace/business news article	https://www.axios.com/2023/02/22/chatgpt-jpmorgan-chase-restricts-ai	2026-05-25	pre-cutoff workplace software-control reporting	secondary	data/chatgpt_reception_axios_snapshots_i0071.tsv	SNAP-20260525-023 records a local text-render snapshot from the web reader; use only as one named JPMorgan Chase workplace software-control example with Axios/Telegraph attribution, not as proof of broad company bans, boardroom panic, or a specific incident.
S-0098	available	ChatGPT sets record for fastest-growing user base - analyst note	Reuters via Investing.com	wire article mirror	https://www.investing.com/news/economy/chatgpt-sets-record-for-fastestgrowing-user-base--analyst-note-2993773	2026-05-25	pre-cutoff text-readable mirror of Reuters/UBS/Similarweb ChatGPT adoption estimate	secondary mirror	data/chatgpt_adoption_source_chain_i0072.tsv	SNAP-20260525-024 records a local text-render mirror of the Reuters article; use only with Reuters/UBS/Similarweb attribution for 100M January 2023 MAU, 13M daily unique visitors, and unusually fast consumer-app ramp framing.
S-0102	available	ChatGPT tops 25 million daily visits	iTWire / David F. Carr, SimilarWeb	guest opinion / traffic analysis	https://itwire.com/guest-articles/guest-opinion/chatgpt-tops-25-million-daily-visits	2026-05-25	pre-cutoff Similarweb-side traffic corroboration published 2023-02-06	primary-adjacent Similarweb-authored secondary publication	data/chatgpt_adoption_source_chain_i0072.tsv	SNAP-20260525-025 records a local text-render snapshot; use only to corroborate that UBS reporting was based in part on Similarweb data and to add early-February traffic context, not as OpenAI confirmation or a replacement for the UBS note.
S-0099	identified	Moderna	OpenAI	customer story	https://openai.com/index/moderna/	2026-05-25	pre-cutoff Enterprise customer-story candidate; publication date and local capture still need verification	primary vendor-hosted customer story	data/chatgpt_enterprise_recovery_plan_i0070.tsv	I-0070 web search found a Moderna/OpenAI customer-story lane with deployment, GPT creation, weekly-active-creator, and conversation-rate candidates. Treat as vendor-hosted customer evidence until local capture, publication-date verification, and quote/context extraction are complete.
S-0100	available_web_reader	PwC is accelerating adoption of AI with ChatGPT Enterprise in US and UK and with clients	PwC	press release	https://www.pwc.com/us/en/about-us/newsroom/press-releases/pwc-us-uk-accelerating-ai-chatgpt-enterprise-adoption.html	2026-05-25	pre-cutoff May 29 2024 customer-side Enterprise adoption source	primary customer-side	manuscript/07-chatgpt-enterprise-pwc-rows.md	SNAP-20260525-030 records web-reader line notes from the PwC press release. Use for PwC-attributed US/UK OpenAI agreement, first-reseller/largest-user framing, workforce access, internal custom-GPT examples, client-service positioning, and AI investment context; do not promote neutral Enterprise market share, paid seat counts, active usage, client adoption, or productivity outcomes without independent rows.
S-0101	identified	Moderna uses OpenAI's ChatGPT Enterprise to scale 750 GPTs	Constellation Research	analyst/news article	https://www.constellationr.com/insights/news/moderna-uses-openais-chatgpt-enterprise-scale-750-gpts	2026-05-25	pre-cutoff April 24 2024 secondary triangulation for Moderna Enterprise deployment	secondary	data/chatgpt_enterprise_recovery_plan_i0070.tsv	I-0070 web search found this as a dated secondary triangulation lane for Moderna's 750 GPTs and weekly-active-user claims; use only after local/archive capture and comparison against S-0099.
S-0103	available_web_reader	OpenAI signs 100K PwC workers to ChatGPT's enterprise tier as PwC becomes its first resale partner	TechCrunch / Ingrid Lunden	technology news article with OpenAI executive interview	https://techcrunch.com/2024/05/29/openai-signs-on-100k-pwc-workers-to-its-chatgpt-enterprise-tier-as-the-consultant-becomes-its-first-resale-partner/	2026-05-25	pre-cutoff independent/OpenAI-side corroboration for PwC ChatGPT Enterprise commercial-role framing	secondary with OpenAI-side interview	data/chatgpt_enterprise_pwc_corroboration_i0085.tsv	SNAP-20260525-031 records web-reader line notes; use to corroborate, with attribution, PwC as OpenAI's largest customer and first partner reselling ChatGPT Enterprise, plus 100,000-user coverage/access scale. Do not use for pricing, revenue, active usage, paid seats, productivity outcomes, or global rollout.
S-0104	available	A Neural Probabilistic Language Model	Bengio, Ducharme, Vincent, and Jauvin	JMLR paper	https://jmlr.org/papers/v3/bengio03a.html	2026-05-25	pre-cutoff foundational neural language-modeling source	primary	manuscript/01-before-the-transformer.md	Use for distributed word representations, curse-of-dimensionality framing, and neural probabilistic language-model background; do not use for exact modern LLM capability claims.
S-0105	available	Efficient Estimation of Word Representations in Vector Space	Mikolov, Chen, Corrado, and Dean	arXiv / Google Research paper	https://arxiv.org/abs/1301.3781	2026-05-25	pre-cutoff word2vec/embedding source	primary	manuscript/01-before-the-transformer.md	Use for efficient continuous word-vector learning from large datasets and similarity/analogy evaluation framing; do not treat vector analogies as proof of human-like understanding.
S-0106	available	Sequence to Sequence Learning with Neural Networks	Sutskever, Vinyals, and Le	arXiv / NeurIPS paper	https://arxiv.org/abs/1409.3215	2026-05-25	pre-cutoff seq2seq source	primary	manuscript/01-before-the-transformer.md	Use for encoder-decoder sequence learning and machine-translation sequence-transduction framing; extract exact result numbers separately before using them.
S-0107	available	Neural Machine Translation by Jointly Learning to Align and Translate	Bahdanau, Cho, and Bengio	arXiv paper	https://arxiv.org/abs/1409.0473	2026-05-25	pre-cutoff attention/alignment source	primary	manuscript/01-before-the-transformer.md	Use for attention/alignment as a fix for fixed-length encoder bottlenecks in neural machine translation; do not treat attention weights as full behavioral explanations.
S-0108	available	Transformer: A Novel Neural Network Architecture for Language Understanding	Google Research	official research blog	https://research.google/blog/transformer-a-novel-neural-network-architecture-for-language-understanding/	2026-05-25	pre-cutoff official Google Research Transformer commentary	primary official commentary	manuscript/02-attention-catches-fire.md	Use for Google Research public framing of the Transformer and self-attention dependencies; use S-0002 for exact architecture claims and do not infer modern LLM implementation details from the blog.
S-0115	available	PaLM: Scaling Language Modeling with Pathways	Chowdhery et al.	arXiv abs local capture	assets/source_docs/google_deepmind/S-0115_palm-arxiv-abs.html	2026-05-25	pre-cutoff PaLM source, locally captured	primary	manuscript/09-google-deepmind-gemini.md	Use for PaLM 540B and Pathways framing; exact benchmark and training-system details still need extraction rows before charting.
S-0116	available	Gemini: A Family of Highly Capable Multimodal Models	Google DeepMind	arXiv abs local capture	assets/source_docs/google_deepmind/S-0116_gemini-arxiv-abs.html	2026-05-25	pre-cutoff Gemini technical-report source, locally captured	primary	manuscript/09-google-deepmind-gemini.md	Use for Gemini family and multimodal technical framing; do not use vendor benchmark claims as neutral superiority claims without row extraction.
S-0117	available	Gemini 1.5: Unlocking multimodal understanding across millions of tokens of context	Google DeepMind	arXiv abs local capture	assets/source_docs/google_deepmind/S-0117_gemini15-arxiv-abs.html	2026-05-25	pre-cutoff Gemini 1.5 long-context source, locally captured	primary	manuscript/09-google-deepmind-gemini.md	Use for long-context technical arc; do not claim long context solves retrieval, memory, codebase understanding, or enterprise knowledge work.
S-0118	available	Sign up to try Bard from Google	Google	product blog local capture	assets/source_docs/google_deepmind/S-0118_try-bard-google-blog.html	2026-05-25	pre-cutoff Bard product-framing source, locally captured	primary vendor	manuscript/09-google-deepmind-gemini.md	Use for Bard as early experiment and complementary-to-Search framing; do not infer adoption or quality.
S-0119	available	Gemini 2.5: Our newest Gemini model with thinking	Google DeepMind	product blog local capture	assets/source_docs/google_deepmind/S-0119_gemini-model-thinking-updates-march-2025.html	2026-05-25	pre-cutoff Gemini 2.5 product-framing source, locally captured	primary vendor	manuscript/09-google-deepmind-gemini.md	Use for thinking/reasoning product grammar; exact benchmarks and best-model claims remain blocked.
S-0120	available	Google DeepMind model cards	Google DeepMind	model-card page local capture	assets/source_docs/google_deepmind/S-0120_deepmind-model-cards.html	2026-05-25	mutable model-card page captured after cutoff	primary vendor with mutable-page caveat	manuscript/09-google-deepmind-gemini.md	Use as documentation-surface and source-discovery handle only until rows are normalized for cutoff status.
S-0121	available	Introducing Gemini: Google's most capable AI model	Google and Google DeepMind	product blog local capture	assets/source_docs/google_deepmind/S-0121_google-gemini-ai-launch-blog.html	2026-05-25	pre-cutoff Gemini launch product source, locally captured	primary vendor	manuscript/09-google-deepmind-gemini.md	Use for Gemini launch, Ultra/Pro/Nano, multimodal banner, Google DeepMind framing, and TPU-infrastructure attribution.
S-0122	available	Bard becomes Gemini: Try Ultra 1.0 and a new mobile app today	Google	product blog local capture	assets/source_docs/google_deepmind/S-0122_bard-becomes-gemini-blog.html	2026-05-25	pre-cutoff Bard-to-Gemini product source, locally captured	primary vendor	manuscript/09-google-deepmind-gemini.md	Use for product consolidation and Gemini Advanced/mobile app framing; do not infer revenue, subscriptions, or user satisfaction.
S-0123	available	Get more done with Gemini: Try 1.5 Pro and more intelligent features	Google	product blog local capture	assets/source_docs/google_deepmind/S-0123_gemini-may-2024-update.html	2026-05-25	pre-cutoff Gemini 1.5 product source, locally captured	primary vendor	manuscript/09-google-deepmind-gemini.md	Use for one-million-token consumer product framing with attribution; availability and adoption claims need normalization.
S-0124	available	Gemini 1.5 Pro updates, 1.5 Flash debut and Gemma updates	Google	developer blog local capture	assets/source_docs/google_deepmind/S-0124_gemini-gemma-developer-updates-may-2024.html	2026-05-25	pre-cutoff Gemini developer product source, locally captured	primary vendor	manuscript/09-google-deepmind-gemini.md	Use for Gemini 1.5 Pro/Flash developer access and two-million-token access-path framing; exact availability claims need date-specific normalization.
S-0125	available	OpenAI forms exclusive computing partnership with Microsoft	Microsoft News	official announcement local capture	assets/source_docs/microsoft_openai/S-0125_ms-openai-2019-computing-partnership.html	2026-05-25	pre-cutoff Microsoft/OpenAI computing partnership source, locally captured	primary vendor	manuscript/08-microsoft-openai-cloud-bargain.md	Use for 2019 exclusive computing partnership, Azure AI supercomputing, and preferred-partner framing; do not infer product success.
S-0126	available	OpenAI, Microsoft build Azure AI supercomputer	Microsoft Source	official feature local capture	assets/source_docs/microsoft_openai/S-0126_ms-openai-2020-supercomputer.html	2026-05-25	pre-cutoff Azure/OpenAI supercomputer source, locally captured	primary vendor	manuscript/08-microsoft-openai-cloud-bargain.md	Use for Azure-hosted supercomputer and infrastructure relationship; keep ranking/performance language attributed.
S-0127	available	Microsoft teams up with OpenAI to exclusively license GPT-3 language model	Microsoft	official blog local capture	assets/source_docs/microsoft_openai/S-0127_ms-gpt3-exclusive-license.html	2026-05-25	pre-cutoff GPT-3 licensing source, locally captured	primary vendor	manuscript/08-microsoft-openai-cloud-bargain.md	Use for GPT-3 license, API route remaining available, and Microsoft customer-solution framing; do not overstate ownership or future rights.
S-0128	capture_failed	OpenAI licenses GPT-3 technology to Microsoft	OpenAI	official post capture failed	https://openai.com/index/openai-licenses-gpt-3-technology-to-microsoft/	2026-05-25	pre-cutoff source candidate but shell capture 403	candidate primary	none	Do not cite for final prose until browser/archive capture succeeds; recorded as a source gap from I-0113.
S-0129	available	General availability of Azure OpenAI Service expands access to large advanced AI models	Microsoft Azure	official blog local capture	assets/source_docs/microsoft_openai/S-0129_azure-openai-service-ga.html	2026-05-25	pre-cutoff Azure OpenAI Service GA source, locally captured	primary vendor	manuscript/08-microsoft-openai-cloud-bargain.md	Use for enterprise/developer access-route framing; do not infer customer outcomes, revenue, or usage.
S-0130	available	Microsoft and OpenAI extend partnership	Microsoft	official blog local capture	assets/source_docs/microsoft_openai/S-0130_ms-openai-2023-extend-partnership.html	2026-05-25	pre-cutoff extended partnership source, locally captured	primary vendor	manuscript/08-microsoft-openai-cloud-bargain.md	Use for 2023 extension, investment, supercomputing, deployment, and platform framing with attribution.
S-0131	available	Introducing Microsoft 365 Copilot: your copilot for work	Microsoft	official blog local capture	assets/source_docs/microsoft_openai/S-0131_microsoft-365-copilot-intro.html	2026-05-25	pre-cutoff Microsoft 365 Copilot source, locally captured	primary vendor	manuscript/08-microsoft-openai-cloud-bargain.md	Use for app-surface and Microsoft Graph/work-context framing; productivity and ROI claims remain blocked.
S-0132	available	Introducing GitHub Copilot: your AI pair programmer	GitHub	official product post local capture	assets/source_docs/microsoft_openai/S-0132_github-copilot-ai-pair-programmer.html	2026-05-25	pre-cutoff GitHub Copilot source, locally captured	primary vendor	manuscript/08-microsoft-openai-cloud-bargain.md	Use for technical preview, VS Code surface, OpenAI collaboration, and Codex powering claim; no productivity/adoption claims.
S-0133	available	ChatGPT is now available in Azure OpenAI Service	Microsoft Azure	official blog local capture	assets/source_docs/microsoft_openai/S-0133_chatgpt-azure-openai-service.html	2026-05-25	pre-cutoff ChatGPT-on-Azure source, locally captured	primary vendor	manuscript/08-microsoft-openai-cloud-bargain.md	Use for ChatGPT availability in Azure OpenAI Service; no usage-volume or enterprise-uptake claims.
S-0109	available_local_html	Introducing computer use, a new Claude 3.5 Sonnet, and Claude 3.5 Haiku	Anthropic	product post	https://www.anthropic.com/news/3-5-models-and-computer-use	2026-05-25	pre-cutoff Claude 3.5 update and computer-use source	primary local HTML asset	manuscript/12-anthropic-and-claude-spine-section.md;assets/source_docs/anthropic/S-0109_claude-3-5-computer-use.html	Use for October 2024 computer-use public-beta chronology and qualitative tool-use transition; do not use for autonomy, productivity, or safety-in-use claims without separate evidence.
S-0110	available_local_pdf_ignored	The Claude 3 Model Family: Opus, Sonnet, Haiku	Anthropic	model card PDF	https://assets.anthropic.com/m/61e7d27f8c8f5919/original/Claude-3-Model-Card.pdf	2026-05-25	pre-cutoff Claude 3 model-card source with later addenda	primary local PDF asset	manuscript/12-anthropic-and-claude-spine-section.md;assets/source_docs/anthropic/S-0110_claude-3-model-card.pdf	Use for model-family, multimodal, Constitutional AI continuity, and safety/evaluation framing; PDF is local but ignored as heavyweight source media, with hash recorded in data/anthropic_source_asset_hashes_i0103.tsv.
