blocker_id	applies_to	allowed_use	blocked_use	required_evidence_before_final
ACCEL-BLOCK-001	product renders	Show what a vendor publicly presented as the accelerator, board, rack, or cluster surface.	Do not infer shipments, customer adoption, supply, utilization, availability, or real deployment scale from product art.	Official product page or press kit plus date, rights note, and caption attribution.
ACCEL-BLOCK-002	performance specs	Use vendor-reported specs only as vendor-reported specs with exact product/version/date labels.	Do not normalize FLOPS, tokens/sec, throughput, TCO, energy, or benchmark advantage across vendors without same-task methodology.	Primary technical docs plus benchmark methodology, workload, precision, batch, model, software stack, and date.
ACCEL-BLOCK-003	roadmaps and announced parts	Label future or announced accelerators as roadmap/announced at the source date.	Do not write future parts as shipped history or guaranteed capability.	Later product page, availability announcement, or independent shipment/deployment evidence.
ACCEL-BLOCK-004	China and export context	Show domestic accelerator source surfaces only where they explain LLM compute constraints or alternatives.	Do not infer export-control outcomes, sanctioned-market share, hidden fabs, process node, or parity from images.	Official source plus credible independent reporting or filings for export/supply claims.
ACCEL-BLOCK-005	cloud-owned silicon	Explain why Google/AWS custom accelerators matter as cloud infrastructure, not as consumer products.	Do not infer internal workload volume, customer share, pricing advantage, or strategic success from product pages.	Cloud docs, pricing snapshots, case studies, filings, or credible external reporting with matching dates.
ACCEL-BLOCK-006	visual comparisons	Use neutral taxonomies and scale ladders to teach categories and system levels.	Do not create winner/loser charts, spec league tables, or implied rankings without a normalized evidence contract.	Source matrix with comparable fields, missing-data markers, and a written reason each comparison is fair.
