review_id	asset_id	source_ids	redraw_type	copied_source_geometry	exact_values_used	rights_status	blocked_until
RDR-20260526-012	A-0153	S-0153;S-0154	conceptual_redraw	no	no	needs_page_ref_review	BPE/SentencePiece page refs and final caption wording are recorded
RDR-20260526-013	A-0154	S-0160;S-0161;S-0162	conceptual_redraw	no	no	needs_page_ref_review	deduplication, memorization, and extraction measured-scope page refs are recorded
RDR-20260526-014	A-0155	S-0110;S-0023;S-0024;S-0026;S-0027;S-0028;S-0029;S-0030;S-0031	conceptual_redraw	no	no	needs_source_specific_review	final chosen model-card/report rows are source-specific and rights-reviewed
RDR-20260526-015	A-0066	S-0042;S-0157;S-0158;S-0159;S-0163	existing_original_svg	no	no	manifest_recorded	component/page extraction required before table-like specificity
RDR-20260526-016	A-0067	S-0160;S-0161;S-0162	existing_original_svg	no	no	manifest_recorded	effect-size extraction required before quantified claims
RDR-20260526-017	A-0030	S-0111;S-0023;S-0025;S-0024;S-0113;S-0008	existing_original_svg	no	no	manifest_recorded	release/source page refs required before final open-weight family caption
RDR-20260526-018	A-0031	S-0026;S-0027;S-0028;S-0029;S-0030;S-0031;C-0007	existing_original_svg	no	no	manifest_recorded	source-gap language must remain visible in final Chapter 11 layout
