visual_id	order	asset_id	source_page	source_asset	source_ids	file_path	visual_role	claim_status	caption_rule	blocked_claims
GTCVIS-001	1	A-0024	29	A-0004	S-0001	assets/visual_system/gtc-page29-ai-factory-thesis-card.svg	ai_factory_thesis	announced;framing	Use as NVIDIA's public thesis that AI factories are industrial infrastructure; attribute the frame to NVIDIA.	Do not present AI factory as a neutral industry definition or proof of deployed factory economics.
GTCVIS-002	2	A-0025	45	A-0005	S-0001;S-0067	assets/visual_system/gtc-page45-inference-compute-roadmap-card.svg	inference_compute_roadmap	roadmap;availability_claim;performance_claim	Label Groq 3 LPX and the 2H26 line as NVIDIA roadmap/availability evidence.	Do not treat specs, availability, or performance values as shipped or independently verified facts.
GTCVIS-003	3	A-0026	46	A-0006	S-0001;S-0010	assets/visual_system/gtc-page46-vera-rubin-partner-card.svg	vera_rubin_partner_announcement	announced;partner_claim;performance_claim	Label Vera Rubin NVL72 as an NVIDIA announcement with partner/performance claims.	Do not convert partner lists, perf-per-watt, NVFP4, HBM4, or NVLink6 claims into neutral facts without corroboration.
GTCVIS-004	4	A-0027	49	A-0007	S-0001;S-0010	assets/visual_system/gtc-page49-system-comparison-card.svg	system_comparison	performance_claim;system_framing	Use the one-gigawatt comparison as NVIDIA's system-level AI factory argument.	Do not chart exact ratios, token throughput, revenue, or deployed capacity as independent evidence.
GTCVIS-005	5	A-0028	50	A-0008	S-0001;S-0065;S-0067	assets/visual_system/gtc-page50-roadmap-card.svg	roadmap	roadmap	Preserve the 2024/2026/2028 cadence and label future-generation items as roadmap by the cutoff.	Do not write 2028 or future-generation roadmap items as happened history.
GTCVIS-006	6	A-0029	51	A-0009	S-0001;S-0066	assets/visual_system/gtc-page51-dsx-platform-card.svg	dsx_reference_design	announced;reference_design_claim	Use DSX as NVIDIA's reference-design/platform framing across chips, systems, facilities, software, cooling, and power.	Do not imply customer deployment, adoption scale, or facility performance without DSX corroboration.
