id	section	change	source_or_claim_refs	blocker_preserved	verification_note
CH1REWRITE-001	opener	Removed status and source apparatus from the first screen so the chapter opens directly on the November 30, 2022 ChatGPT text-box scene.	S-0006;CH1SHOCK-001	No direct quotation from the OpenAI launch page; no private launch-scene detail.	First lines now begin with prose after the chapter title.
CH1REWRITE-002	opener	Sharpened the truthful hook around a plain typing box, fallible fluency, and the question of what kind of object institutions and users had encountered.	CH1SHOCK-003;CH1SHOCK-005	No broad public panic, national school-ban claim, quantified reception claim, or universal reaction claim.	Named institutional reactions remain scoped in the later Local Alarms section.
CH1REWRITE-003	drafting_controls	Moved metric and claim guardrails into a dedicated drafting-controls section after the opening beat.	CH1SHOCK-004;C-0010	Fastest-growing-app superlative, OpenAI-confirmed 100M users, paid users, revenue, retention, and productivity outcomes remain blocked.	Guardrails remain visible to editors without occupying the first reader-facing screen.
CH1REWRITE-004	ending	Replaced the closing verification task list with a narrative handoff from ChatGPT shock to the older history of machine prediction.	CH1SHOCK-006	Does not duplicate Chapter 7 productization arc; preserves Chapter 1 as the central-question doorway.	Final section now closes on the Chapter 2 transition rather than internal TODOs.
CH1REWRITE-005	blockers	Preserved the I-0117 outstanding verification tasks in this audit row rather than as the chapter's closing reader text.	CH1SHOCK-001;CH1SHOCK-002;CH1SHOCK-004;CH1SHOCK-005	Launch-page quotation capture, visual package needs, and blocked superlatives remain unresolved.	No blocker is marked resolved by this prose pass.
