row_id	source_ids	source_family	allowed_use	blocked_use	target_location
CH19CODE-SRC-001	S-0052;S-0054	Codex and code-model origin	Frame Codex/code-model work as showing that LLMs trained on code could synthesize programs from natural-language prompts and made HumanEval a useful early evaluation surface.	Do not cite exact model sizes, training data quantities, HumanEval scores, or replacement claims until Codex rows are locally captured and normalized.	manuscript/19-code-as-the-second-native-language.md
CH19CODE-SRC-002	S-0070;S-0132	GitHub Copilot product surface	Frame Copilot as a 2021 editor assistant/pair-programmer product built with OpenAI Codex that suggested code in the developer workflow.	Do not infer active users, paid seats, productivity lift, code quality, security quality, or broad developer acceptance.	manuscript/19-code-as-the-second-native-language.md
CH19CODE-SRC-003	S-0053	AlphaCode contest programming	Use AlphaCode as evidence for contest-programming systems that combine generation, filtering/ranking, and judged feedback.	Do not infer production repository ability, autonomous engineering, or general programmer replacement from contest performance.	manuscript/19-code-as-the-second-native-language.md
CH19CODE-SRC-004	S-0025	Code Llama/open code models	Frame Code Llama as part of the open-code-model diffusion that gave teams research and deployment control surfaces.	Do not infer open-source license simplicity, commercial adoption, benchmark superiority, or secure local deployment.	manuscript/19-code-as-the-second-native-language.md
CH19CODE-SRC-005	S-0035	SWE-bench repository evaluation	Describe SWE-bench as moving code evaluation toward real GitHub issue resolution in existing repositories.	Do not make live leaderboard, current best-model, or productivity claims from SWE-bench alone.	manuscript/19-code-as-the-second-native-language.md
CH19CODE-SRC-006	S-0037	LiveCodeBench contamination-aware evaluation	Describe LiveCodeBench as a contamination-aware, continuously collected, broader code-evaluation benchmark including repair/execution-related tasks.	Do not use it as a live ranking source or proof of general software engineering ability.	manuscript/19-code-as-the-second-native-language.md
CH19CODE-SRC-007	S-0035;S-0037;S-0053;C-0013	Benchmark contract	Use these rows to require task shape, contamination boundary, scaffold, tools, attempts, budget, date, and source before numeric comparisons.	Do not build a leaderboard, price-quality curve, productivity chart, or model-crown claim.	manuscript/19-code-as-the-second-native-language.md
CH19CODE-SRC-008	S-0049;S-0050;S-0051;CH20AGENT-003	Chapter 20 boundary	Use Claude Code docs only as continuity evidence that repo agents add context management, permissions, commands, tests, and review beyond Chapter 19's broad code arc.	Do not let Chapter 19 absorb Claude Code's case-study details or product-specific security defaults.	manuscript/19-code-as-the-second-native-language.md
