id	chapter_scope	visual_title	visual_type	source_ids	claim_rows	story_purpose	caption_contract	blocked_claims	next_gate
CH2-4VIS-001	Chapter 2 / Before the Transformer	Pre-Transformer Bottleneck Map	pressure-chain diagram	S-0104;S-0105;S-0106;S-0107;S-0002	C-0115;CH2Q-001	Map the path from sparse counts to embeddings, recurrent sequence state, fixed-vector seq2seq bottleneck, attention relief, and the Transformer handoff.	Figure 2.x - The Bottleneck Before The Breakthrough. The diagram shows technical pressures that made attention and Transformer blocks useful; it is not a complete NLP history or priority claim.	First-invention claims; state-of-the-art rankings; hidden industrial adoption; attention-as-consciousness; complete NLP history.	Build as one rights-safe SVG after confirming Chapter 1/2 final numbering.
CH2-4VIS-002	Chapter 3 / Attention Catches Fire	Self-Attention Information Flow	architecture schematic	S-0002;S-0108	CH2Q-002;CH2Q-003;CH2Q-004;CH2Q-005;CH2Q-006;CH2Q-011	Show token embeddings, position signal, query/key/value projections, attention weights, value mixing, multi-head branch, and feed-forward/residual wrapper.	Figure 3.x - Attention Is A Mixing Operation, Not A Mind. Self-attention routes information among token positions, but it does not prove intention, truth, grounding, faithful explanation, or modern LLM implementation details.	Human-like attention; consciousness; full modern decoder-only implementation; distance-is-free; stable head semantics; solved truth/grounding.	Build before any later architecture schematic so readers have a substrate visual.
CH2-4VIS-003	Chapter 3 / Attention Catches Fire	Recurrence Versus Self-Attention	contrast diagram	S-0002;S-0108	CH2Q-001;CH2Q-005;CH2Q-008;CH2Q-013	Contrast recurrent stepwise state passing with self-attention routes across positions and a parallel-training opportunity lane.	Figure 3.x - The Break In The Loop. Self-attention changes the route of information flow and training parallelism; it does not eliminate all context cost or explain later product dominance by itself.	Parallelism-alone causality; context cost disappearance; long-context solved; hardware-alone selection; eternal Transformer dominance.	Use only if the self-attention schematic needs a companion; otherwise fold into CH2-4VIS-002.
CH2-4VIS-004	Chapter 4 / The Scaling Bet	Scaling Evidence-Lane Chart	permission curve / claim-control chart	S-0003;S-0015;S-0004;S-0016	CH3Q-001;CH3Q-002;CH3Q-003;CH3Q-004;CH3Q-006;CH3Q-008	Show measured loss, modeled extrapolation, industry interpretation, bounded GPT-3/PaLM examples, and blocked capability/truth/safety/product claims as separate lanes.	Figure 4.x - Loss Is A Map, Not A Product Guarantee. Scaling evidence can support measured loss and compute/data/model tradeoffs, but not automatic truth, safety, product success, or emergence thresholds.	Exact exponents; plotted Kaplan values; universal token/parameter formula; emergence cliffs; benchmark values; revenue; product success; safety from scale.	Build as schematic unless exact values are extracted and row-audited.
CH2-4VIS-005	Chapter 4 / The Scaling Bet	Compute-Data-Parameter Triangle	tradeoff diagram	S-0003;S-0015	CH3Q-001;CH3Q-004;CH3Q-010	Show compute allocation among model size, training tokens, and data/optimization quality, with Chinchilla as a balance warning.	Figure 4.x - Scale Became Allocation. Compute must be spent across model size, data, and training quality; bigger parameter count alone is not the sourced claim.	Bigger-is-always-better; exact Chinchilla formula; universal token ratio; dataset-specific claims; compute as business proof.	Make a second Chapter 4 figure only if the evidence-lane chart is too dense.
CH2-4VIS-006	Chapters 2-4	Technical Visual Sequence	placement plan	S-0104;S-0105;S-0106;S-0107;S-0002;S-0003;S-0015	C-0115;C-0116;C-0117	Recommended sequence: pressure-chain map, self-attention schematic, scaling evidence-lane chart; optional recurrence contrast and compute triangle only if final layout needs them.	The first three figures should teach mechanism before any company or benchmark drama appears.	Generic timelines; repeated benchmark ladders; decorative diagrams; unsupported source-history claims.	Use this sequence in the later actual SVG package.
CH2-4VIS-007	Chapters 2-4	Anti-Duplication Rule	visual grammar rule	data/full_book_visual_inventory_i0134.tsv;assets_manifest.tsv	C-0157	Keep early visuals technical and mechanism-led, not another business-platform map, leaderboard, agent loop, or blocker grid.	Early figures should help the reader understand what later diagrams assume.	Duplicate visual grammar; count inflation; visually pretty but technically generic figures.	Apply when drawing final SVGs.
CH2-4VIS-008	Chapters 2-4	Source/Claim Boundary	claim-control rule	S-0104;S-0105;S-0106;S-0107;S-0002;S-0003;S-0015;S-0004	CH2Q-010;CH3Q-007	No chart or diagram count increases until actual lightweight assets and asset-manifest rows exist.	This pass is a visual plan, not a completed figure package.	Counting planned figures as created; using source IDs as permission for extra numbers or quotes.	Draw assets in a later pass with manifest/provenance rows.
