source_id	title	source_type	local_path	capture_status	allowed_use	blocked_use	next_step
S-0035	SWE-bench: Can Language Models Resolve Real-World GitHub Issues?	arXiv abstract	assets/source_docs/coding_agents/S-0035_swe-bench-arxiv-abs.html	captured	Repository-issue benchmark framing and historical difficulty.	Live leaderboard, current best-model claims, or product superiority.	Extract PDF table only if numeric historical comparison is needed.
S-0037	LiveCodeBench: Holistic and Contamination Free Evaluation of Large Language Models for Code	arXiv abstract	assets/source_docs/coding_agents/S-0037_livecodebench-arxiv-abs.html	captured	Contamination-free and broader code-capability evaluation framing.	Current leaderboard or provider superiority.	Capture benchmark site snapshot before any rankings.
S-0049	Best practices for Claude Code	documentation	assets/source_docs/coding_agents/S-0049_claude-code-best-practices.html	captured	Context and workflow guidance at a structural level.	Exact commands/settings without row extraction.	Extract headings and quote-safe snippets in a later cleanup pass.
S-0050	Claude Code security	documentation	assets/source_docs/coding_agents/S-0050_claude-code-security.html	captured	Permission, read-only/default, approval, review, and prompt-injection guardrail framing.	Enterprise security guarantees or universal safety claims.	Pair with settings/permissions page snapshot before final layout.
S-0051	Claude Code common workflows	documentation	assets/source_docs/coding_agents/S-0051_claude-code-common-workflows.html	captured	Workflow task categories such as codebase understanding, bug fixing, testing, and refactoring.	Productivity/adoption outcomes.	Extract quote-safe workflow rows later.
