visual_id	order	asset_id	file_path	visual_role	source_ids	claim_rows	caption_rule	caveat
CH16VIS-001	1	A-0015	assets/visual_system/power-to-token-flow.svg	power_to_token_stack	S-0001;S-0039;S-0040;S-0066;S-0083;S-0084;S-0085;S-0086;S-0087;S-0088	CH16Q-017;CH16Q-018	Use existing Figure 16.1 as the mechanism stack from electricity and interconnection through facility/cooling, accelerators, scheduling, and tokens.	Not an energy-per-token estimate; not proof of NVIDIA performance, roadmap, partner, availability, or deployment claims.
CH16VIS-002	2	A-0020	assets/visual_system/chapter16-data-center-load-scenarios.svg	data_center_load_scenarios	S-0083;S-0084;S-0085	CH16Q-001;CH16Q-002;CH16Q-003;CH16Q-004;CH16Q-005;CH16Q-006;CH16Q-011;CH16Q-012	Show measured/current estimates separately from projected/scenario ranges for global and U.S. data-centre electricity demand.	Forecasts/scenarios are not happened history; do not collapse ranges into one deterministic future.
CH16VIS-003	3	A-0021	assets/visual_system/chapter16-interconnection-queue-schematic.svg	interconnection_queue_schematic	S-0083;S-0086;S-0087	CH16Q-007;CH16Q-008;CH16Q-009;CH16Q-010;CH16Q-013;CH16Q-014	Show the timing mismatch between hyperscale load requests and grid equipment/study queues.	Advisory and risk estimates; not a project-level database and not proof of delay for any named campus.
CH16VIS-004	4	A-0022	assets/visual_system/chapter16-cooling-rack-density-note.svg	cooling_rack_density_note	S-0087;S-0088	CH16Q-015;CH16Q-016	Show cooling and rack density as facility constraints between power access and useful accelerator deployment.	Uptime is an operator-survey signal; detailed engineering claims need future technical corroboration.
CH16VIS-005	5	A-0023	assets/visual_system/chapter16-clean-power-physical-supply.svg	clean_power_vs_physical_supply	S-0083;S-0087	CH16Q-011;CH16Q-012	Show the distinction between corporate procurement instruments and physical hourly supply to a load.	Do not equate PPAs/certificates with the physical fuel mix serving a specific site and hour.
