claim_id	status	claim	location	source_ids	support_quality	checked_date	notes
CH20AGENT-001	supported	SWE-bench can be described as a benchmark that asks language models to edit real codebases in response to GitHub issue descriptions, rather than only solve isolated coding exercises.	manuscript/20-claude-code-industrialized-pair-programming.md	S-0035	primary arXiv abstract plus local capture	2026-05-25	Allowed: repository-issue framing, real GitHub issues, codebase editing, multi-file complexity. Blocked: live leaderboard or current best-model claims.
CH20AGENT-002	supported	LiveCodeBench can be described as a contamination-focused and broader code-evaluation benchmark that continuously collects new contest problems and evaluates capabilities beyond plain code generation.	manuscript/20-claude-code-industrialized-pair-programming.md	S-0037	primary arXiv abstract plus local capture	2026-05-25	Allowed: contamination-free framing, new problems over time, LeetCode/AtCoder/CodeForces source platforms, self-repair/execution/test-output prediction. Blocked: current leaderboard or provider superiority.
CH20AGENT-003	supported	Claude Code can be framed as a terminal/repository agent in which context management, tool permissions, file edits, command execution, tests, and human review form the work loop.	manuscript/20-claude-code-industrialized-pair-programming.md	S-0022;S-0049;S-0050;S-0051	primary docs plus local captures	2026-05-25	Allowed: structural workflow synthesis. Blocked: exact settings/defaults beyond captured security wording, productivity claims, adoption claims, and enterprise outcomes.
CH20AGENT-004	needs-verification	Exact Claude 4 SWE-bench Verified, Terminal-bench, or best-coding-model claims require benchmark version, harness/scaffold, tool permissions, sample budget, date, and source snapshot before charting.	manuscript/20-claude-code-industrialized-pair-programming.md	S-0007;S-0035;S-0037;C-0013	blocker	2026-05-25	The chapter intentionally uses Anthropic benchmark language only as vendor-attributed positioning and does not reproduce numeric comparative claims.
CH20AGENT-005	supported	Anthropic security docs support saying Claude Code is read-only by default and requests permission for additional actions such as edits, tests, and command execution, with user responsibility for reviewing proposed code and commands.	manuscript/20-claude-code-industrialized-pair-programming.md	S-0050	local docs capture	2026-05-25	Allowed as captured-page product behavior; future final draft should recheck exact current docs and permissions/settings pages before quoting defaults.
