block	old_state	action	new_role	guardrail
Anthropic/Claude spine	supplemental source section after Europe/xAI draft	promote_to_front_of_chapter_12	main behavior-to-action company arc	No benchmark-number, price-quality, adoption, productivity, or alignment-solved claim promoted.
Mistral	official Chapter 12 candidate lead	retain_after_anthropic	open-weight, sovereignty, deployment, and MoE efficiency pressure	No market-share, adoption, or independent price-performance crown.
xAI	official Chapter 12 candidate lane	retain_after_anthropic	compute-speed, Grok release, social-distribution pressure	No independent best-model, truthfulness, adoption, or benchmark-rank claim.
Cohere	official Chapter 12 candidate lane	retain_after_anthropic	enterprise retrieval, tooling, agents, and multilingual operationalization pressure	No market-share, productivity, or broad enterprise-adoption claim.
AI21	official Chapter 12 candidate lane	retain_after_anthropic	hybrid SSM-Transformer architecture diversity pressure	No independent long-context superiority claim.
Claude Code	risk of duplicating Chapter 20	keep_as_bridge_only	evidence that Claude moves from behavior to action	Chapter 20 owns repository loop, permissions, tests, harnesses, productivity traps.
