card_id	status	chapter	source_ids	asset_refs	source_surface	local_path	bytes	sha256	capture_status	recommended_treatment	allowed_caption	blocked_claims	next_action	owner_pass
CH20SC-0201-001	source_card_ready_no_raster	20	S-0048	A-0131;A-0095;A-0096	Claude 3.7 Sonnet and Claude Code launch source	assets/source_docs/anthropic/S-0048_claude-3-7-sonnet-claude-code.html	158988	F7760349F30410D1EFFE490F6FF462C154BA0DE3FCEAF7C0C4270C9B5D3B990B	local_html_hashed	source-card or small product-source inset	Anthropic's February 2025 Claude Code launch surface as dated product evidence for coding-agent packaging.	autonomous_engineer;developer_replacement;productivity_lift;secure_code;benchmark_superiority;enterprise_adoption;revenue;current_ui	Extract only dated launch/product-positioning rows; keep benchmark and productivity language out of captions.	I-0201
CH20SC-0201-002	source_card_ready_no_raster	20	S-0022	A-0034;A-0131	Claude Code overview documentation	assets/source_docs/anthropic/S-0022_claude-code-overview.html	1173276	E75606322BD5718C0D1B9B3A5B5FEE8A932BBE1E0C0B76154BB8AF09616B6D02	local_html_hashed	source-card companion to tool-call lifecycle	Anthropic Claude Code overview documentation as a source surface for repository-work framing and tool-connected workflow.	autonomous_engineering;productivity_lift;secure_by_default;adoption;replacement;benchmark_rank;current_ui	Use for workflow/tooling structure only; quote exact commands or settings only after excerpt review.	I-0201
CH20SC-0201-003	source_card_ready_no_raster	20	S-0049	A-0041	Claude Code best-practices documentation	assets/source_docs/coding_agents/S-0049_claude-code-best-practices.html	1432204	D627F624A8FE2C175708F0DF3CDCD9254D745C200AED1AF906E5D70A95D972E9	local_html_hashed	source-card or screenshot substitute	Claude Code best-practices documentation as source texture for context management and workflow discipline.	productivity_lift;adoption;enterprise_outcome;developer_replacement;security_effectiveness;current_ui;universal_workflow	Use paraphrase-first; any command/example excerpt needs quote-limit review.	I-0201
CH20SC-0201-004	source_card_ready_no_raster	20	S-0050	A-0042;A-0034	Claude Code security and permissions documentation	assets/source_docs/coding_agents/S-0050_claude-code-security.html	1059848	5F9C66BFFA364514ED30F09609540E320ACDF86F33767198F8172A11BC50610F	local_html_hashed	permission-boundary source card	Claude Code security documentation as an action-boundary source surface for permissions, review, and tool trust.	secure_by_default;solved_safety;enterprise_compliance;incident_prevention;autonomous_operation;productivity;replacement	Keep as permission-boundary evidence, not proof of real-world safety or security outcomes.	I-0201
CH20SC-0201-005	source_card_ready_no_raster	20	S-0051	A-0043	Claude Code common-workflows documentation	assets/source_docs/coding_agents/S-0051_claude-code-common-workflows.html	1496447	EA7F28F47F503605C08CB6F4FBD32F0D9837B57EFE9140D9EDDBB95F8A2042A6	local_html_hashed	workflow-taxonomy source card	Claude Code common-workflows documentation as dated source texture for repository-task and terminal-agent work loops.	enterprise_outcome;adoption;productivity_lift;developer_replacement;autonomy;security_effectiveness;current_ui	Use to name workflow categories only; avoid copying command blocks until quote review.	I-0201
CH20SC-0201-006	source_card_ready_no_raster	19;20	S-0035	A-0032;A-0033;A-0092	SWE-bench arXiv source surface	assets/source_docs/coding_agents/S-0035_swe-bench-arxiv-abs.html	47643	998A92461B56F5D6109A4C9161C6A2A12649F95CA14715B0A439BFCF01F16885	local_html_hashed	benchmark-contract source card	SWE-bench as repository-repair benchmark source surface, with task, split, scaffold, tools, and pass conditions named before any score.	autonomous_engineer;developer_replacement;productivity;secure_code_quality;live_coding_crown;all_software_engineering	Pair with benchmark-contract fields before any numeric result or model comparison.	I-0201
CH20SC-0201-007	source_card_ready_no_raster	19;20	S-0037	A-0033;A-0092	LiveCodeBench arXiv source surface	assets/source_docs/coding_agents/S-0037_livecodebench-arxiv-abs.html	48077	C394E902FCCB4705DCFCF3DF5AA08C4376D19EF202A8879FAFF1107232333720	local_html_hashed	contamination-caveat source card	LiveCodeBench as contamination-aware coding-evaluation source surface with release window and task-source caveats visible.	best_coder;production_ready;current_rank;all_software_engineering;productivity;secure_code_quality	Use for evaluation-design literacy; capture leaderboard only if final layout needs a dated source-page inset.	I-0201
