card_id	shortlist_id	source_surface	chapter_targets	source_ids	local_surface_status	local_paths	local_sha256	visual_role	caption_must_name	blocked_claims	next_action
DATASC-0203-001	DCS-0195-001	Tokenization / BPE / SentencePiece source surface	17	S-0043;S-0153;S-0154	ready_local_hash	assets/source_docs/chatgpt_opener/S-0043_tiktoken_github.html;assets/source_docs/data_tokens_i0121/S-0153_bpe-rare-words-arxiv-abs.html;assets/source_docs/data_tokens_i0121/S-0154_sentencepiece-arxiv-abs.html	2173368B0E0347CEC299C14529A8953CAF83376AE3E535B66AFAEEC4C20C06AA;3A9597CA025B52B49EC7E2CBBE51B2F3B6ABBBECFE70CF8CF9DAA76BA893AA64;D42D6DB9041A7F61641636B9E6652B6A35A0002FAAD97E80E92160DE217556BF	source card / redraw provenance	algorithm family; source date; implementation or paper surface; mechanism scope	exact modern tokenizer behavior; language cost comparisons; model-specific tokenization; semantic understanding; closed-model tokenizer choices	extract page/section refs and design quote-safe paraphrase card
DATASC-0203-002	DCS-0195-002	Common Crawl to C4 filter funnel	17	S-0155;S-0156;S-0261	ready_local_hash_for_C4_papers_identified_only_for_Common_Crawl	assets/source_docs/data_tokens_i0121/S-0155_t5-c4-arxiv-abs.html;assets/source_docs/data_tokens_i0121/S-0156_documenting-c4-arxiv-abs.html	0DECB7E06E541118586F70CEE95B91CE86049B7A582444D96A091BA6D18B0DC8;E01B8EEB74C299A2E84121B3EE659F67A448AA21F7394E7FC2447EB834351CA9	source card / filter-funnel caption contract	raw crawl; cleaning step; disclosed corpus; provenance critique; source surface	closed-model corpus use; legal cleanliness; consent; representativeness; quality rank; demographic effects without extraction	capture Common Crawl page locally or keep as cited-only reserve
DATASC-0203-003	DCS-0195-003	The Pile and Dolma open-corpus recipe board	17	S-0042;S-0157;S-0158	ready_local_hash_for_arxiv_surfaces	assets/source_docs/data_tokens_i0121/S-0157_pile-arxiv-abs.html;assets/source_docs/data_tokens_i0121/S-0158_dolma-arxiv-abs.html	FB67AECF1C3250C310B489D445DDA94A4F0241AA0D8063939973631DCF56C19D;DBF5776455E02F113BDD5ED13A62B652EDF9B59ECC5100C2E085D86DE262261A	open-corpus recipe source card	dataset name; disclosed scale; component/recipe status; source type; date	proprietary frontier corpus composition; dataset representativeness; legal status; performance superiority; exact component shares	extract component table/page refs before any mixture diagram
DATASC-0203-004	DCS-0195-004	Deduplication as training decision	17;23	S-0160	ready_local_hash	assets/source_docs/data_tokens_i0121/S-0160_deduplicating-training-data-arxiv-abs.html	648A9A844524052136633618DFD76DB20F7A4F8B84F500B5C98FB965EF8E47A3	mechanism card / caution mini-diagram	source paper; duplicate-removal scope; affected artifact type; measured context	exact effect sizes without extraction; universal quality improvement; solved contamination; closed-model dedup policy	extract claims and page refs for dedup/memorization/evaluation links
DATASC-0203-005	DCS-0195-005	Memorization and extraction risk surface	17;23	S-0161;S-0162	ready_local_hash	assets/source_docs/data_tokens_i0121/S-0161_extracting-training-data-arxiv-abs.html;assets/source_docs/data_tokens_i0121/S-0162_quantifying-memorization-arxiv-abs.html	8C02186E2506F03B41D63275F818FA968660C6DC1CDE317940DD80E54095A6C2;0B68CD91B442090D23DBE93308BCF58AFE64F24EFBEB3BA65264F0FE9C5BB8D3	source card / risk taxonomy	paper; model/data setting; memorization or extraction definition; measurement boundary	product safety; model-specific leakage prevalence; legal conclusions; universal privacy failure; solved mitigation	extract definitions and preserve risk as condition-dependent
DATASC-0203-006	DCS-0195-007	FineWeb decants the web	17	S-0159;S-0262	ready_local_hash_for_HF_page_identified_only_for_paper	assets/source_docs/data_tokens_i0121/S-0159_fineweb-hf.html	2AE07D436F4283E5B12BDCD87EA39F348EC2C268BBF20E073342AE72C7184718	reserve source card / modern web-processing surface	source page vs paper; Common Crawl processing; dataset scope; date	quality crown; benchmark impact; superiority over other corpora; legal status; exact filter effects	capture or download paper surface before promoting beyond reserve
DATASC-0203-007	DCS-0195-011	ROOTS / BigScience multilingual corpus governance	11;17	S-0266	identified_only	no_local_file	n/a	provenance-caution card	multilingual corpus; governance/documentation scope; paper date; source type	representativeness; legal sufficiency; governance success; multilingual quality; closed-model corpus use	capture local source surface or leave as cited-only reserve
DATASC-0203-008	DCS-0195-012	BookCorpus documentation-debt blocker card	5;17	S-0267	identified_only	no_local_file	n/a	provenance-caution card	documentation-debt frame; retrospective datasheet; source date; source type	closed-model use of BookCorpus; legal conclusions; exact training mixtures; universal dataset invalidity	capture local source surface or leave as cited-only reserve
