blocker_id	applies_to	allowed_use	blocked_use	required_evidence_before_final
SITE-BLOCK-001	satellite or aerial imagery	Show visible land use, approximate footprint, roads, buildings, substations, cooling yards, or construction change if date and source are recorded.	Do not infer GPU count, server count, power draw, energization, occupancy, customer workload, model training, emissions, or operational status.	Date-stamped image source, license, geolocation method, and independent source for any non-visible claim.
SITE-BLOCK-002	geolocation confidence	Use high/medium/low confidence labels and explain what anchors the location: official address, parcel, permit, utility page, local record, or map cross-check.	Do not present a visually plausible site as confirmed without authoritative location evidence.	Official address/parcel/permit or two independent location anchors with source dates.
SITE-BLOCK-003	power equipment	Use visible substations, generators, batteries, cooling equipment, or transmission lines as physical context.	Do not infer MW, fuel mix, runtime, grid interconnection status, emissions, backup role, or site owner from imagery alone.	Permit, utility filing, interconnection document, environmental filing, or operator statement.
SITE-BLOCK-004	hyperscale project announcements	Use company announcements to identify named projects and the claims the company made at the time.	Do not treat announced capacity, chip counts, timelines, "world's most powerful" language, or partnership claims as delivered history without later same-scope evidence.	Official project update, regulatory filing, utility document, or independent reporting with date-bounded status.
SITE-BLOCK-005	licensing and publication	Use OSM, USGS/Landsat, NASA, DOE, or other public/CC sources only with row-level attribution and license notes; use commercial satellite only with explicit license.	Do not screenshot Google Maps/Earth, Bing, Maxar, Apple Maps, or other commercial imagery for publication without rights clearance.	License text, attribution line, permitted-use note, and screenshot/source hash.
SITE-BLOCK-006	community and environmental claims	Use local-source surfaces to show that infrastructure raised public, utility, or permitting questions.	Do not claim health impacts, legal violations, emissions totals, local fuel mix, or community outcomes from imagery or advocacy snippets alone.	Official permit/regulatory source plus credible local/independent reporting, with exact date and scope.
