pass_id	figure_id	chapter	chapter_anchor	asset_id	asset_type	figure_title	inserted_after_heading	planned_status	rights_status	caption_gate	provenance_gate	placement_status	next_gate
I-0242	F22.01	CH22	ch22-fig01	A-0082	svg_diagram	The Meter Is Visible Before The Margin Is Knowable	The Meter Appears	selected_pending_render	ready_svg	claim_language_review	provenance_contract_ok	section_callout_inserted_not_final_layout	Verify price/currentness caveats.
I-0242	F22.02	CH22	ch22-fig02	A-0083	svg_diagram	Routing, Caching, Batching, Distillation	The API Turns Intelligence Into Units	selected_pending_render	ready_svg	claim_language_review	provenance_contract_ok	section_callout_inserted_not_final_layout	Keep distinct from Chapter 8 cost stack.
I-0242	F22.03	CH22	ch22-fig03	A-0084	svg_diagram	Intelligence Is Sold Through More Than One Door	Inference Rent	selected_pending_render	ready_svg	claim_language_review	provenance_contract_ok	section_callout_inserted_not_final_layout	Caption blocks margin and ARR claims.
I-0242	F22.04	CH22	ch22-fig04	A-0085	svg_diagram	The Tempting Economics Claims Are Not The Sourced Ones	The Subsidy Question	selected_pending_render	ready_svg	claim_language_review	provenance_contract_ok	section_callout_inserted_not_final_layout	Use as sidebar if layout is dense.
I-0242	F23.01	CH23	ch23-fig01	A-0074	svg_diagram	Failure Modes Are Different Claims	23. Failure Modes, Truth, and Trust	selected_pending_render	ready_svg	claim_language_review	provenance_contract_ok	section_callout_inserted_not_final_layout	Prevent incident montage.
I-0242	F23.02	CH23	ch23-fig02	A-0075	svg_diagram	Trust Is A Stack	23. Failure Modes, Truth, and Trust	selected_pending_render	ready_svg	claim_language_review	provenance_contract_ok	section_callout_inserted_not_final_layout	Check if final chapter repeats it.
I-0242	F23.03	CH23	ch23-fig03	A-0076	svg_diagram	Every Evaluation Casts A Shadow	23. Failure Modes, Truth, and Trust	selected_pending_render	ready_svg	claim_language_review	provenance_contract_ok	section_callout_inserted_not_final_layout	Use with benchmark chapters cross-reference.
I-0242	F23.04	CH23	ch23-fig04	A-0077	svg_diagram	From Answer To Auditable Claim	23. Failure Modes, Truth, and Trust	selected_pending_render	ready_svg	caption_contract_ok	provenance_contract_ok	section_callout_inserted_not_final_layout	Pair with source-density prose.
I-0242	F24.01	CH24	ch24-fig01	A-0108	svg_diagram	From Next Token To Computing Stack	24. Next Token	selected_pending_render	ready_svg	claim_language_review	provenance_contract_ok	section_callout_inserted_not_final_layout	Keep from becoming generic summary wallpaper.
I-0242	F24.02	CH24	ch24-fig02	A-0109	svg_diagram	Five Conversion Gates	24. Next Token	selected_pending_render	ready_svg	caption_contract_ok	provenance_contract_ok	section_callout_inserted_not_final_layout	Use if final prose follows conversion motif.
I-0242	F24.03	CH24	ch24-fig03	A-0110	svg_diagram	Unsettled By The Cutoff	24. Next Token	selected_pending_render	ready_svg	caption_contract_ok	provenance_contract_ok	section_callout_inserted_not_final_layout	Keep if not too apparatus-heavy.
I-0242	F24.04	CH24	ch24-fig04	A-0111	svg_diagram	Human Judgment Loop	24. Next Token	selected_pending_render	ready_svg	claim_language_review	provenance_contract_ok	section_callout_inserted_not_final_layout	Use as closing visual if layout has room.
