pass_id	risk_id	status	evidence	recommended_action
I-0306	private_visual_rights	open	Found/company/source-surface visuals remain private-use only; public-use clearance is not claimed.	Keep private or replace/license/redraw before public distribution.
I-0306	heavy_local_artifacts	open	Best reader-polished PDF and contact sheet remain local ignored files; committed pointers store path/hash/metrics.	Preserve rendered/ locally or regenerate from scripts.
I-0306	programmatic_audit_limits	open	Claim and pointer QA are automated checks, not a full human legal/factual review.	Human review is still required before external distribution.
I-0306	reader_polish	partial	I-0305 added four text-only reader gates and rendered a 685-page local proof, but the resulting PDF is not publication-surface clean.	Treat I-0305 as a proof only until I-0307-I-0309 repair local path leaks, process residue, and visual placement.
I-0306	local_path_and_process_residue	open	The user observed C:/ path leakage in the PDF; path/process/proof language makes the book look assembled rather than published.	Run I-0307 first: scan rendered PDF and source captions, remove local filesystem paths and production residue, then rerender.
I-0306	contextual_visual_integration	open	The current proof has visual mass, but too much evidence is still concentrated in atlas/board/end-matter structures instead of being placed near the scene or argument it supports.	Run I-0308 next: redistribute strong visuals into chapter context and cut weak, placeholder, duplicated, or out-of-context visuals.
I-0306	publishable_pdf_surface	open	The book is not yet a publishable-looking PDF: it must read like a professionally edited nonfiction book, with no AI/process traces and no local path artifacts.	Run I-0309 third: render a publication-surface proof and QA every page for path leaks, residue, placement, caption/source readability, and visual rhythm.
I-0306	page_map_shift	open	I-0305 adds pages, so I-0302 page-map inventory still refers to I-0301 positions.	Fold the page-map repair into the publishable-PDF passes rather than treating it as mere bookkeeping.
