pass_id	inventory_id	visual_family	visual_category	board_or_section_id	pdf_page	asset_id	asset_type	title	file_path	sha256	source_or_provenance	private_use_status	story_purpose	blocked_claims	render_location	page_mapping_method_i0302	page_mapping_evidence_i0302
I-0302	FI-0097	expanded_300_exhibit	curated_chart_data_svg_visualization	F24.01	388	A-0108	svg_diagram	Figure 24.1 - From Next Token To Computing Stack. Next-token prediction is surrounded by data, architecture, training, products, tools, infrastructure, economics, and trust.	assets/visual_system/chapter24-next-token-stack-map.svg	2f9996b9c1d4e8d71f1b84b692a79521954de811db237b48945dbe9ced3686bc	Source IDs: CH24SYN-001;CH24SYN-002;CH24SYN-005;CH24SYN-012; Asset source: Generated Chapter 24 final next-token stack map; Creator/org: Codex	publish_after_render_caption_source_note_qa	I-0261 source-file proof exists; I-0262 render embedding and I-0263 page-legibility QA still required.	Original workspace visual may support only its scoped data/mechanism claim; no outcome, rank, productivity, safety, or market conclusion without matching evidence.	final_private_pdf_main_expanded_300_layer	figure_or_section_id	F24.01
I-0302	FI-0098	expanded_300_exhibit	curated_chart_data_svg_visualization	F24.02	389	A-0109	svg_diagram	Figure 24.2 - Five Conversion Gates. Prediction-to-interface, interface-to-product, model-to-platform, compute-to-infrastructure, and fluency-to-trust are shown as overlapping pressures.	assets/visual_system/chapter24-five-conversion-gates.svg	39f317a3a29246d1dce22983c92e5a323c2728d6e972be308163c743af5517b5	Source IDs: CH24SYN-002;CH24SYN-007;CH24SYN-013; Asset source: Generated Chapter 24 five conversion gates diagram; Creator/org: Codex	publish_after_render_caption_source_note_qa	I-0261 source-file proof exists; I-0262 render embedding and I-0263 page-legibility QA still required.	Original workspace visual may support only its scoped data/mechanism claim; no outcome, rank, productivity, safety, or market conclusion without matching evidence.	final_private_pdf_main_expanded_300_layer	figure_or_section_id	F24.02
I-0302	FI-0099	expanded_300_exhibit	curated_chart_data_svg_visualization	F24.03	390	A-0110	svg_diagram	Figure 24.3 - Unsettled By The Cutoff. Tempting end-of-book claims are paired with the same-scope evidence still required.	assets/visual_system/chapter24-unsettled-claims-board.svg	5f5a6dc3933c4db675c433cfc05669d6e63a3232004a170ed7c5d065e12cf1d0	Source IDs: CH24SYN-008;CH24SYN-010;CH24SYN-014;CH24SYN-016; Asset source: Generated Chapter 24 unsettled claims board; Creator/org: Codex	publish_after_render_caption_source_note_qa	I-0261 source-file proof exists; I-0262 render embedding and I-0263 page-legibility QA still required.	Original workspace visual may support only its scoped data/mechanism claim; no outcome, rank, productivity, safety, or market conclusion without matching evidence.	final_private_pdf_main_expanded_300_layer	figure_or_section_id	F24.03
I-0302	FI-0100	expanded_300_exhibit	curated_chart_data_svg_visualization	F24.04	391	A-0111	svg_diagram	Figure 24.4 - Human Judgment Loop. User intent, model tokens, tools, evidence trace, audit, blockers, and human decision form the closing loop.	assets/visual_system/chapter24-human-judgment-loop.svg	e321a93c2f21c16802f936797d551554450f7a6e1a5a05aad7aae34654544af5	Source IDs: CH24SYN-003;CH24SYN-008;CH24SYN-015;CH24SYN-017; Asset source: Generated Chapter 24 human judgment loop; Creator/org: Codex	publish_after_render_caption_source_note_qa	I-0261 source-file proof exists; I-0262 render embedding and I-0263 page-legibility QA still required.	Original workspace visual may support only its scoped data/mechanism claim; no outcome, rank, productivity, safety, or market conclusion without matching evidence.	final_private_pdf_main_expanded_300_layer	figure_or_section_id	F24.04
I-0302	FI-0101	expanded_300_exhibit	curated_chart_data_svg_visualization	VX001	402	A-0001	svg_diagram	Generated visual grammar prototype	assets/visual_system/chronology-rail-prototype.svg	73fe86714a9cbc35a0ebc08bda4ca4276279b316a7fc1079dbcf85a8d3d52500	local:manuscript/00-visual-grammar.md	Original lightweight SVG generated for this private manuscript workspace.	Establishes recurring timeline grammar for the book.	Private-use visual evidence handle only; does not prove adoption, live rank, current product state, revenue, safety, deployment, biography, or performance beyond its cited surface.	final_private_pdf_main_expanded_300_layer	figure_or_section_id	VX001
I-0302	FI-0102	expanded_300_exhibit	curated_chart_data_svg_visualization	VX002	403	A-0002	svg_diagram	Generated visual grammar prototype	assets/visual_system/agent-loop-prototype.svg	d3a79b9b9a1f9c520df95dafb13be60a5459112b0a8d8e40dae254527cf721a5	local:manuscript/00-visual-grammar.md	Original lightweight SVG generated for this private manuscript workspace.	Establishes agent workflow grammar around human framing, model planning, tools, checks, review, and iteration.	Private-use visual evidence handle only; does not prove adoption, live rank, current product state, revenue, safety, deployment, biography, or performance beyond its cited surface.	final_private_pdf_main_expanded_300_layer	figure_or_section_id	VX002
I-0302	FI-0103	expanded_300_exhibit	curated_chart_data_svg_visualization	VX003	404	A-0003	svg_diagram	Generated visual grammar prototype	assets/visual_system/tradeoff-curve-prototype.svg	709669d33787368b59f458c46bc4a4738208c92692d4b20b1b922fe5dd30960f	local:manuscript/00-visual-grammar.md	Original lightweight SVG generated for this private manuscript workspace.	Establishes chart grammar for tradeoffs while foregrounding uncertainty and snapshot requirements.	Private-use visual evidence handle only; does not prove adoption, live rank, current product state, revenue, safety, deployment, biography, or performance beyond its cited surface.	final_private_pdf_main_expanded_300_layer	figure_or_section_id	VX003
I-0302	FI-0104	expanded_300_exhibit	curated_chart_data_svg_visualization	VX004	405	A-0010	svg_diagram	Generated GPT lineage visual table	assets/visual_system/gpt-lineage-table.svg	42ce17c8ef6f8c9baa7b008648e5cff0b4018624f04884f36e2729e39e89bed7	local:data/gpt_lineage_visual_table.tsv	Original lightweight SVG generated for this private manuscript workspace; row data and source IDs are in data/gpt_lineage_visual_table.tsv.	Gives Chapter 5 a compact visual anchor for the shift from pretraining to prompting to API infrastructure to code-at-the-cursor.	Private-use visual evidence handle only; does not prove adoption, live rank, current product state, revenue, safety, deployment, biography, or performance beyond its cited surface.	final_private_pdf_main_expanded_300_layer	figure_or_section_id	VX004
I-0302	FI-0105	expanded_300_exhibit	curated_chart_data_svg_visualization	VX005	406	A-0011	svg_diagram	Generated RLHF and alignment pipeline visual	assets/visual_system/rlhf-alignment-pipeline.svg	40c20c381093c742387b04a88df98d5339dfc0f6ba768f2ab88633f510b497ae	local:data/rlhf_alignment_pipeline_i0023.tsv	Original lightweight SVG generated for this private manuscript workspace; row data and source IDs are in data/rlhf_alignment_pipeline_i0023.tsv.	Gives Chapter 6 a mechanism visual showing assistant behavior as a layered product stack rather than evidence that alignment is solved.	Private-use visual evidence handle only; does not prove adoption, live rank, current product state, revenue, safety, deployment, biography, or performance beyond its cited surface.	final_private_pdf_main_expanded_300_layer	figure_or_section_id	VX005
I-0302	FI-0106	expanded_300_exhibit	curated_chart_data_svg_visualization	VX006	407	A-0012	svg_diagram	Generated AI factory stack visual	assets/visual_system/ai-factory-stack.svg	cdfafac569b97a15dd37227f306e9e6eeac314abfd14e3ecdef534c3c3658e7b	local:data/ai_factory_stack_i0027.tsv	Original lightweight SVG generated for this private manuscript workspace; row data and source IDs are in data/ai_factory_stack_i0027.tsv.	Gives Chapter 15 a reader-friendly mechanism diagram that explains the AI factory stack without converting NVIDIA keynote ratios or roadmap claims into independent facts.	Private-use visual evidence handle only; does not prove adoption, live rank, current product state, revenue, safety, deployment, biography, or performance beyond its cited surface.	final_private_pdf_main_expanded_300_layer	figure_or_section_id	VX006
I-0302	FI-0107	expanded_300_exhibit	curated_chart_data_svg_visualization	VX007	408	A-0013	svg_chart	Generated LMArena historical leaderboard chart	assets/visual_system/lmarena-may19-text-style-control-top12.svg	d9426fec2cbfc899966e0752f5e472a1b68e4f578ae80ff2ec4499f390085a99	local:data/lmarena_may19_chart_i0034.tsv	Original lightweight SVG generated from data/lmarena_may19_chart_i0034.tsv; source rows derive from data/lmarena_clean_cutoff_rows_i0029.tsv and official historical dataset snapshot SNAP-20260525-008.	Gives Chapter 13 a sourced model-ranking visual while making dataset config, category, publish date, and non-live-leaderboard caveats visible.	Private-use visual evidence handle only; does not prove adoption, live rank, current product state, revenue, safety, deployment, biography, or performance beyond its cited surface.	final_private_pdf_main_expanded_300_layer	figure_or_section_id	VX007
I-0302	FI-0108	expanded_300_exhibit	curated_chart_data_svg_visualization	VX008	409	A-0014	svg_diagram	Generated Arena leaderboard methodology flow	assets/visual_system/leaderboard-methodology-flow.svg	a14a77c4c71673cdeb37655c7a40aad19a40a6dcedac2db13df1969f055752c7	local:data/leaderboard_methodology_i0039.tsv	Original lightweight SVG generated from data/leaderboard_methodology_i0039.tsv; no external image assets.	"Teaches readers how to interpret leaderboard rows before seeing any model as ""best,"" and prevents live-rank, release-status, price-quality, and task-superiority overclaims."	Private-use visual evidence handle only; does not prove adoption, live rank, current product state, revenue, safety, deployment, biography, or performance beyond its cited surface.	final_private_pdf_main_expanded_300_layer	figure_or_section_id	VX008
I-0302	FI-0109	expanded_300_exhibit	curated_chart_data_svg_visualization	VX009	410	A-0017	svg_layout_mock	Generated Chapter 16 N16-1 note layout mock	assets/visual_system/chapter16-n16-1-note-layout-mock.svg	c0fe4a5294cd1d7b311e94fb4600c857e5d44fb9d9e4b7bda8ead13a15dc90f9	local:data/chapter16_note_layout_mock_i0063.tsv	Original lightweight SVG generated from data/chapter16_note_layout_mock_i0063.tsv and checked against data/chapter16_note_layout_acceptance_i0063.tsv; no external image assets; C-0021/C-0047 remain active.	Gives Chapter 16 a visual QA artifact for source-cue cleanup before any production prose merge or PDF layout change.	Private-use visual evidence handle only; does not prove adoption, live rank, current product state, revenue, safety, deployment, biography, or performance beyond its cited surface.	final_private_pdf_main_expanded_300_layer	figure_or_section_id	VX009
I-0302	FI-0110	expanded_300_exhibit	curated_chart_data_svg_visualization	VX010	411	A-0018	svg_layout_mock	Generated Chapter 16 parent inline-cue render	assets/visual_system/chapter16-n16-1-parent-inline-render.svg	aaa9b460eebe0d1cef0e16fe61083957c1c1a65f3768587beeb3bfd2450c584e	local:manuscript/16-speed-to-power.md;data/chapter16_n16_1_render_comparison_i0073.tsv	Original lightweight SVG generated for this private manuscript workspace; no external image assets; not a production PDF screenshot.	Provides the parent side of the I-0073 A/B comparison against the N16-1 candidate mock and makes the readability tradeoff auditable before any live prose merge.	Private-use visual evidence handle only; does not prove adoption, live rank, current product state, revenue, safety, deployment, biography, or performance beyond its cited surface.	final_private_pdf_main_expanded_300_layer	figure_or_section_id	VX010
I-0302	FI-0111	expanded_300_exhibit	curated_chart_data_svg_visualization	VX011	412	A-0019	svg_diagram	Generated price-quality exclusion map	assets/visual_system/price-quality-exclusion-map.svg	820f9c46e4bbaf0aa3c1bc5837be95c22064cced2108108ea81244660aff4bf2	local:data/chapter13_price_quality_exclusion_map_i0098.tsv	Original lightweight SVG generated from data/chapter13_price_quality_exclusion_map_i0098.tsv and data/price_quality_join_audit_i0036.tsv; no external image assets; C-0046 remains active.	Gives Chapter 13 a third visual slot that makes the blocked price-quality frontier honest and visible instead of hiding exclusions in prose.	Private-use visual evidence handle only; does not prove adoption, live rank, current product state, revenue, safety, deployment, biography, or performance beyond its cited surface.	final_private_pdf_main_expanded_300_layer	figure_or_section_id	VX011
I-0302	FI-0112	expanded_300_exhibit	curated_chart_data_svg_visualization	VX012	413	A-0022	svg_diagram	Generated Chapter 16 cooling and rack-density note	assets/visual_system/chapter16-cooling-rack-density-note.svg	39eeb698bb604e44bbf60c79872cdedc89ae0a68873dea12eb4bfac5723de9e8	local:data/chapter16_infrastructure_visual_package_i0099.tsv	Original lightweight SVG generated from data/chapter16_infrastructure_visual_package_i0099.tsv and existing CH16Q audit rows; no external image assets; Uptime is treated as operator-survey signal.	Shows cooling and rack density as facility constraints between power access and useful accelerator deployment without overclaiming engineering specifics.	Private-use visual evidence handle only; does not prove adoption, live rank, current product state, revenue, safety, deployment, biography, or performance beyond its cited surface.	final_private_pdf_main_expanded_300_layer	figure_or_section_id	VX012
I-0302	FI-0113	expanded_300_exhibit	curated_chart_data_svg_visualization	VX013	414	A-0024	svg_claim_card	Generated GTC page 29 AI factory thesis card	assets/visual_system/gtc-page29-ai-factory-thesis-card.svg	2ac7fafe588749de5329984f3344e6c334536188492b2a5465223c730b1143c6	local:data/chapter15_gtc_visual_source_pack_i0101.tsv	Original lightweight SVG derived from GTC-2026-Keynote.pdf page 29 notes and A-0004 caption row; no external image assets; C-0047 remains active.	Gives Chapter 15 a commit-safe slide-derived card that carries page provenance and blocks neutral AI-factory economics claims.	Private-use visual evidence handle only; does not prove adoption, live rank, current product state, revenue, safety, deployment, biography, or performance beyond its cited surface.	final_private_pdf_main_expanded_300_layer	figure_or_section_id	VX013
I-0302	FI-0114	expanded_300_exhibit	curated_chart_data_svg_visualization	VX014	415	A-0025	svg_claim_card	Generated GTC page 45 inference compute roadmap card	assets/visual_system/gtc-page45-inference-compute-roadmap-card.svg	2faff52cd5ad3f1742c3774c7f30667f3c89c91d04f6748d658b78a201a6a62b	local:data/chapter15_gtc_visual_source_pack_i0101.tsv	Original lightweight SVG derived from GTC-2026-Keynote.pdf page 45 notes and A-0005 caption row; no external image assets; C-0047 remains active.	Gives Chapter 15 a commit-safe slide-derived card that preserves the roadmap and availability caveat before prose expansion.	Private-use visual evidence handle only; does not prove adoption, live rank, current product state, revenue, safety, deployment, biography, or performance beyond its cited surface.	final_private_pdf_main_expanded_300_layer	figure_or_section_id	VX014
I-0302	FI-0115	expanded_300_exhibit	curated_chart_data_svg_visualization	VX015	416	A-0026	svg_claim_card	Generated GTC page 46 Vera Rubin partner card	assets/visual_system/gtc-page46-vera-rubin-partner-card.svg	9288ebc7a990c5c24b5901e906d2e71c1cd7be5009b5dbf273181ec6eec1a1b0	local:data/chapter15_gtc_visual_source_pack_i0101.tsv	Original lightweight SVG derived from GTC-2026-Keynote.pdf page 46 notes and A-0006 caption row; no external image assets; C-0047 remains active.	Gives Chapter 15 a page-provenance visual for Vera Rubin without converting partner/performance claims into independent fact.	Private-use visual evidence handle only; does not prove adoption, live rank, current product state, revenue, safety, deployment, biography, or performance beyond its cited surface.	final_private_pdf_main_expanded_300_layer	figure_or_section_id	VX015
I-0302	FI-0116	expanded_300_exhibit	curated_chart_data_svg_visualization	VX016	417	A-0027	svg_claim_card	Generated GTC page 49 system comparison card	assets/visual_system/gtc-page49-system-comparison-card.svg	da268383adec7d6f526e000a7874d3a0bde07311347867cc407805afbc1f1942	local:data/chapter15_gtc_visual_source_pack_i0101.tsv	Original lightweight SVG derived from GTC-2026-Keynote.pdf page 49 notes and A-0007 caption row; no external image assets; C-0047 remains active.	Gives Chapter 15 a safe visual handle for NVIDIA's promotional system argument while blocking independent throughput, revenue, or deployed-capacity claims.	Private-use visual evidence handle only; does not prove adoption, live rank, current product state, revenue, safety, deployment, biography, or performance beyond its cited surface.	final_private_pdf_main_expanded_300_layer	figure_or_section_id	VX016
I-0302	FI-0117	expanded_300_exhibit	curated_chart_data_svg_visualization	VX017	418	A-0028	svg_claim_card	Generated GTC page 50 roadmap card	assets/visual_system/gtc-page50-roadmap-card.svg	63a7b33a774b03615eef30ef83fa199d2ff073fd4d494957abfd0abe20d49270	local:data/chapter15_gtc_visual_source_pack_i0101.tsv	Original lightweight SVG derived from GTC-2026-Keynote.pdf page 50 notes and A-0008 caption row; no external image assets; C-0047 remains active.	Gives Chapter 15 a cutoff-bounded roadmap visual that keeps future-generation items from becoming happened history.	Private-use visual evidence handle only; does not prove adoption, live rank, current product state, revenue, safety, deployment, biography, or performance beyond its cited surface.	final_private_pdf_main_expanded_300_layer	figure_or_section_id	VX017
I-0302	FI-0118	expanded_300_exhibit	curated_chart_data_svg_visualization	VX018	419	A-0030	svg_diagram	Generated Llama family open-weight map	assets/visual_system/llama-family-open-weight-map.svg	3f8f3744768b8306a246cef2d82cba9800aa6c1371623fe1a731a7700cf04ef5	local:data/chapter10_llama_family_tree_i0104.tsv	Original lightweight SVG generated from data/chapter10_llama_family_tree_i0104.tsv and local Meta/arXiv HTML captures; no external image assets.	Gives Chapter 10 a family-tree visual that explains release surfaces and blocks benchmark, license, adoption, safety, and price-quality overclaims.	Private-use visual evidence handle only; does not prove adoption, live rank, current product state, revenue, safety, deployment, biography, or performance beyond its cited surface.	final_private_pdf_main_expanded_300_layer	figure_or_section_id	VX018
I-0302	FI-0119	expanded_300_exhibit	curated_chart_data_svg_visualization	VX019	420	A-0031	svg_diagram	Generated China open-model source-permission map	assets/visual_system/china-open-model-source-map.svg	82c6d061e77aaa0873b109b1f51c4dccb8c5ded29aa39fb5510dbecb563fc939	local:data/chapter11_china_open_model_source_map_i0105.tsv	Original lightweight SVG generated from data/chapter11_china_open_model_source_map_i0105.tsv and local arXiv HTML captures; no external image assets.	Gives Chapter 11 a visual guardrail that shows supported primary-source lanes separately from Qwen 3.5/3.6, DeepSeek V4-era, MiniMax, Baidu, Tencent, Xiaomi MiMo, and StepFun source gaps.	Private-use visual evidence handle only; does not prove adoption, live rank, current product state, revenue, safety, deployment, biography, or performance beyond its cited surface.	final_private_pdf_main_expanded_300_layer	figure_or_section_id	VX019
I-0302	FI-0120	expanded_300_exhibit	curated_chart_data_svg_visualization	VX020	421	A-0032	svg_diagram	Generated Chapter 20 coding-agent harness loop	assets/visual_system/chapter20-coding-agent-harness-loop.svg	1b6502d470c19f35857b846ee41bc82f5816d2ebdc2bda95b822bf82c9e4c88f	local:data/chapter20_coding_agent_visual_package_i0108.tsv	Original lightweight SVG generated from local Chapter 20 source captures and claim-audit rows; no external image assets.	Shows why coding-agent performance is a system loop rather than a raw model number.	Private-use visual evidence handle only; does not prove adoption, live rank, current product state, revenue, safety, deployment, biography, or performance beyond its cited surface.	final_private_pdf_main_expanded_300_layer	figure_or_section_id	VX020
I-0302	FI-0121	expanded_300_exhibit	curated_chart_data_svg_visualization	VX021	422	A-0033	svg_diagram	Generated Chapter 20 coding benchmark caveat matrix	assets/visual_system/chapter20-benchmark-caveat-matrix.svg	1237ddb3c015861862fed4810bccb337431726e9887083d99d97495ff9ebe1f7	local:data/chapter20_coding_agent_visual_package_i0108.tsv	Original lightweight SVG generated from local Chapter 20 source captures and claim-audit rows; no external image assets.	Lets Chapter 20 use benchmark drama while preserving version, scaffold, date, and productivity blockers.	Private-use visual evidence handle only; does not prove adoption, live rank, current product state, revenue, safety, deployment, biography, or performance beyond its cited surface.	final_private_pdf_main_expanded_300_layer	figure_or_section_id	VX021
I-0302	FI-0122	expanded_300_exhibit	curated_chart_data_svg_visualization	VX022	423	A-0034	svg_diagram	Generated Chapter 20 tool-call lifecycle	assets/visual_system/chapter20-tool-call-lifecycle.svg	5f733eff6191af8afbd3e6a06576dc6ed4a2211916c14073888aec66e28b5a3b	local:data/chapter20_coding_agent_visual_package_i0108.tsv	Original lightweight SVG generated from local Chapter 20 source captures and claim-audit rows; no external image assets.	Makes the action boundary visible and connects Claude Code security docs to the chapter agency argument.	Private-use visual evidence handle only; does not prove adoption, live rank, current product state, revenue, safety, deployment, biography, or performance beyond its cited surface.	final_private_pdf_main_expanded_300_layer	figure_or_section_id	VX022
I-0302	FI-0123	expanded_300_exhibit	curated_chart_data_svg_visualization	VX023	424	A-0035	svg_diagram	Generated Chapter 20 productivity claim blocker map	assets/visual_system/chapter20-productivity-blocker-map.svg	ccbf4ef05570050d5f8e6363bc840934131c34d348826a97735cb43b77e0409f	local:data/chapter20_coding_agent_visual_package_i0108.tsv	Original lightweight SVG generated from local Chapter 20 source captures and claim-audit rows; no external image assets.	Prevents Chapter 20 from laundering benchmark or vendor-doc evidence into business-outcome prose.	Private-use visual evidence handle only; does not prove adoption, live rank, current product state, revenue, safety, deployment, biography, or performance beyond its cited surface.	final_private_pdf_main_expanded_300_layer	figure_or_section_id	VX023
I-0302	FI-0124	expanded_300_exhibit	curated_chart_data_svg_visualization	VX024	425	A-0057	svg_diagram	Generated Chapter 8 cloud-to-product flywheel	assets/visual_system/chapter8-cloud-to-product-flywheel.svg	ca4826aeb621f311b9dd1717bef95d1d9a3e3680bbe190680a1dc52f9edb5cb5	local:data/chapter8_microsoft_openai_visual_package_i0118.tsv	Original lightweight SVG generated from Chapter 8 source and claim-audit rows; no external image assets; outcome claims remain blocked.	Shows the business mechanism behind the cloud bargain without proving financial success, active use, productivity, or deployment scale.	Private-use visual evidence handle only; does not prove adoption, live rank, current product state, revenue, safety, deployment, biography, or performance beyond its cited surface.	final_private_pdf_main_expanded_300_layer	figure_or_section_id	VX024
I-0302	FI-0125	expanded_300_exhibit	curated_chart_data_svg_visualization	VX025	426	A-0068	svg_diagram	Generated Chapter 1 ChatGPT shock chronology	assets/visual_system/chapter1-chatgpt-shock-chronology.svg	aad7dd277c0b339525f481ab4490a291469ff07069c8c076fa498696ff3dcc8c	local:data/chapter1_shock_visual_package_i0123.tsv	Original lightweight SVG generated from Chapter 1 source and claim-audit rows; no external image assets; CH1SHOCK-001/004 caveats remain active.	Makes Chapter 1's launch-speed story legible while preventing fastest-growing-app, OpenAI-confirmed 100M users, paid-user, revenue, retention, productivity, or merged adoption claims.	Private-use visual evidence handle only; does not prove adoption, live rank, current product state, revenue, safety, deployment, biography, or performance beyond its cited surface.	final_private_pdf_main_expanded_300_layer	figure_or_section_id	VX025
I-0302	FI-0126	expanded_300_exhibit	curated_chart_data_svg_visualization	VX026	427	A-0078	svg_diagram	Generated Chapter 21 train-time versus test-time compute axes	assets/visual_system/chapter21-train-vs-test-time-compute.svg	7b4f65f0136022acc3d7f88e1b92a6c63d461d5cb9425719ae18da02c83a8534	local:data/chapter21_reasoning_visual_package_i0130.tsv	Original lightweight SVG generated from Chapter 21 source and claim-audit rows; no external image assets; exact cost/latency, hidden reasoning budget, production routing, and solved-reasoning claims remain blocked.	Shows reasoning as extra inference-time structure without pretending to plot a measured frontier curve.	Private-use visual evidence handle only; does not prove adoption, live rank, current product state, revenue, safety, deployment, biography, or performance beyond its cited surface.	final_private_pdf_main_expanded_300_layer	figure_or_section_id	VX026
