priority	chapter_scope	upgrade_theme	why_it_matters	first_file_to_touch	truth_guardrail
1	1;5;6;7;14;17;18;19;20;21;22;23;24	Replace closing task bullets with narrative handoff closes	Many chapters end in future-work lists, which makes the book feel like an excellent dossier instead of an addictive nonfiction narrative.	manuscript/01-the-shock.md	Do not delete blocker obligations; move them into notes/audit files or preserve them below prose-visible chapter endings.
2	1-7;10;11;14;15;17;18;19;20;22	Move status/source notes below first narrative beat	The first screen of many chapters teaches process before story, weakening Look Inside conversion and reader trust-by-reading.	manuscript/01-the-shock.md	Keep source notes intact and visible to editors, but make the chapter opening begin with the reader-facing hook.
3	12	Resolve Chapter 12 identity before prose polish	Narrative addiction cannot fix a chapter that is structurally two chapters at once.	manuscript/12-europe-xai-rest-frontier.md	Do not lose mandatory Anthropic/Claude, Mistral, xAI, or rest-frontier coverage.
4	8;9;15;16;23	Use strongest chapters as house-style exemplars	These chapters show the book's best current narrative moves: clean image, institutional stakes, mechanism, handoff.	manuscript/16-speed-to-power.md	Do not copy tone mechanically; preserve each chapter's source boundaries and topic function.
5	13;22	Add one human-facing use case before abstraction	Methodology and economics are important but can feel like apparatus unless the reader first feels the desire for a crown or meter.	manuscript/13-model-rankings-appendix.md	Do not fabricate scenes or user anecdotes; use generic reader/operator framing unless sourced examples exist.
6	21-24	Convert late-book bullet endings into one acceleration chain	The final third must feel like reasoning cost, money, trust, and judgment are one unresolved machine.	manuscript/21-reasoning-test-time-compute.md	Keep AGI, consciousness, live-rank, productivity, revenue, energy, autonomy, and solved-trust claims blocked.
