action_id	action	gate_type	evidence_or_asset	reason	blocked_until_done
FIGACT-001	Treat data/full_book_figure_list_i0229.tsv as the temporary canonical figure ID ledger until the final selected matrix changes.	numbering_gate	data/full_book_figure_list_i0229.tsv	Stable IDs reduce caption, source-note, and cross-reference drift.	final_page_numbers; publication_ready_index
FIGACT-002	When an exhibit is inserted, removed, or moved across chapters, update the figure list and record the selection-matrix change in the same pass.	change_control_gate	data/master_100_exhibit_selection_matrix_i0182.tsv;data/full_book_figure_list_i0229.tsv	Figure numbers depend on selected order, not manifest order.	silent_renumbering; stale_cross_reference
FIGACT-003	Use figure_id and chapter_anchor together in manuscript references; never cite only the asset ID in reader-facing prose.	cross_reference_gate	data/full_book_figure_list_i0229.tsv	Asset IDs are production handles, while figure IDs are book-facing.	reader_visible_asset_id; broken_cross_reference
FIGACT-004	Do not mark selected_pending_capture, selected_pending_rights_review, or selected_pending_source_surface_review rows as publication-ready until their capture, rights, and source-note gates pass.	readiness_gate	data/full_book_figure_list_i0229.tsv;assets_manifest.tsv	Selected does not mean publishable.	publication_ready; rights_cleared; final_source_note
FIGACT-005	Keep alt text concise and claim-safe; revise any generated alt text during final layout when the exact crop or page context changes.	accessibility_gate	data/full_book_figure_list_i0229.tsv	Alt text should explain the figure without adding unsupported claims.	accessibility_complete; crop_specific_alt
FIGACT-006	Preserve source_ids from the source-note QA ledger and resolve blanks before final render.	source_gate	data/selected_100_source_note_attribution_qa_i0217.tsv;data/full_book_figure_list_i0229.tsv	Every final figure needs source/provenance continuity.	missing_source_id; source_note_proximity
FIGACT-007	Use caption_gate and provenance_gate fields as render-smoke test inputs for I-0230.	render_gate	data/full_book_figure_list_i0229.tsv	The next render pass needs a deterministic list of what to inspect.	render_smoke_complete; page_image_proof
FIGACT-008	Freeze figure numbering only after the rights-risk triage and page-flow mock decide replacements.	sequencing_gate	I-0231;I-0235	The current list is stable for production, not final against all future replacements.	final_figure_list; print_ready_toc
