decision_id	decision	item_ids	reason	final_program_implication
GTCXD-0192-001	core_sequence	GTCX-0192-001;GTCX-0192-002;GTCX-0192-003;GTCX-0192-004	These four carry the GTC argument: thesis, DSX platform, system comparison, and roadmap cadence.	Chapter 15 should use no more than three or four GTC source surfaces from this core set.
GTCXD-0192-002	economics_reserve	GTCX-0192-005;GTCX-0192-006;GTCX-0192-007	The economics and inference-scaling slides are high-value but require chart mining, exact axis extraction, and stronger caveats.	Keep as planned source-card/redraw candidates, not current top-100 replacements.
GTCXD-0192-003	supporting_product_rows	GTCX-0192-008;GTCX-0192-009;GTCX-0192-010	Vera Rubin, Groq 3 LPX, and chip/spec slides can support prose but should not dominate final art.	Use only one if it replaces a stronger roadmap or system card.
GTCXD-0192-004	cite_only_or_defer	GTCX-0192-011;GTCX-0192-012;GTCX-0192-013	DSX detail, platform ecosystem, and agent-computing surfaces are secondary to the chapter's AI-factory thesis.	Cite or reserve for later chapter-specific use.
GTCXD-0192-005	drop_from_gtc_visual_program	GTCX-0192-014;GTCX-0192-015	Benchmark/open-model and physical-AI surfaces carry high non-LLM, leaderboard, and robotics drift risk.	Do not put these into the GTC final visual sequence unless independent source rows force reconsideration.
GTCXD-0192-006	merge_duplicate_representations	A-0004;A-0024;A-0106;A-0009;A-0029;A-0107	Page 29 and page 51 each exist as slide renders, claim cards, and hashed source surfaces.	Choose one representation per slide in final layout; keep the others as provenance handles or reserves.
GTCXD-0192-007	chapter_boundary	Core GTC rows versus Chapter 16 independent evidence	GTC is source-actor stagecraft; Chapter 16 must test it with IEA, LBNL, EPRI, DOE, grid, cooling, and power visuals.	Do not let NVIDIA slides carry independent power, deployment, revenue, or facility-performance claims.
