method_step_id	step_title	source_ids	evidence_handle	figure_label	explanation	caveat
LMETH-001	Human preference votes	S-0036;S-0056;S-0057;S-0080	SNAP-20260525-008	Arena vote pool	Arena-style leaderboards begin with pairwise or preference-style human judgments collected for model outputs rather than direct measurement of hidden model quality.	Vote populations, prompts, sampling, interface design, and model availability can shift; do not treat votes as universal truth.
LMETH-002	Config, split, and category filter	S-0080	SNAP-20260525-008	text_style_control / latest / overall	The I-0034 chart uses only rows from the captured historical dataset config `text_style_control`, split `latest`, category `overall`.	Changing config, split, category, or date can change the ranking; never quote rank without these labels.
LMETH-003	Rating and uncertainty	S-0080;S-0036	SNAP-20260525-008	rating plus lower/upper bounds	Rows carry a central rating and lower/upper bounds; close ranks should be read as clusters when intervals overlap.	Rank numbers look discrete, but adjacent models may not be meaningfully separated.
LMETH-004	Publication date and snapshot	S-0080	SNAP-20260525-008	published 2026-05-19	The clean rows are official historical dataset rows published 2026-05-19 and captured locally as SNAP-20260525-008.	This is not a live May 24 screenshot and not proof that a model was commercially available.
LMETH-005	Chart permission gate	S-0057;S-0080;C-0045;C-0046	SNAP-20260525-008	allowed and blocked uses	The dataset can support date-labeled historical rank visuals; price-quality, release-status, and task-specific superiority claims need separate source rows.	Do not mix leaderboard rows with provider prices or benchmark claims until same-scope joins and caveats are explicit.
