placement_id	order_slot	component	artifact_or_asset	placement_decision	reader_job	claim_control	source_spine	next_layout_action
LAPP-001	1	Orientation paragraph	manuscript/13-model-rankings-appendix.md	Add a short lead-in before figures that says the appendix is about how rank evidence is made, not a live model crown.	Prepare readers to interpret rankings as sourced slices with caveats.	Blocks live-rank and best-model framing before the eye reaches rows.	S-0036;S-0056;S-0057;S-0080;SNAP-20260525-008	Use one paragraph; do not add new rank claims.
LAPP-002	2	Condensed methodology glossary	data/leaderboard_methodology_glossary_i0049.tsv	Place a compact glossary box before the methodology figure, using vote, config, split, category, rating, confidence interval, publication date, snapshot, and permission gate.	Define the vocabulary needed to read A-0014 and A-0013.	Keeps caveats in the reading path rather than hiding them after the chart.	LMG-001;LMG-002;LMG-003;LMG-004;LMG-005;LMG-006;LMG-007;LMG-008;LMG-009	Use shortened definitions, not the full source table.
LAPP-003	3	Methodology figure	A-0014;assets/visual_system/leaderboard-methodology-flow.svg	Place immediately after the glossary and before any ranked rows.	Teach votes, filters, uncertainty, dates, snapshots, and permission gates visually.	Satisfies the methodology-before-rank rule and prevents rank rows from feeling self-explanatory.	S-0036;S-0056;S-0057;S-0080;SNAP-20260525-008;data/leaderboard_methodology_i0039.tsv	Use LCAP-001 or LCAP-002 from I-0054.
LAPP-004	4	Transition sentence	manuscript/13-final-caption-microcopy.md	Use the I-0054 prose transition before the chart: after methodology, the chart can make one narrow point about a tightly clustered historical slice.	Move from method to evidence without overselling rank order.	States the narrow allowed claim before the sorted visual appears.	LCAP-007;S-0080;SNAP-20260525-008	Keep the sentence near A-0013.
LAPP-005	5	Historical rank chart	A-0013;assets/visual_system/lmarena-may19-text-style-control-top12.svg	Place after A-0014, never before it.	Let readers inspect the historical top twelve row order and interval overlap.	Allows only the historical `text_style_control` / `latest` / `overall` published-2026-05-19 claim.	S-0080;SNAP-20260525-008;data/lmarena_may19_chart_i0034.tsv	Use LCAP-003 or LCAP-004 from I-0054.
LAPP-006	6	Shared chart footnote	data/leaderboard_rank_row_microstyle_i0050.tsv;data/leaderboard_final_caption_microcopy_i0054.tsv	Place directly below A-0013 or in the nearest sidenote, not at the end of the appendix.	Keep release-status, non-live-rank, and uncertainty caveats visible while preserving caption economy.	Blocks release-status proof, live-rank language, price-quality shortcuts, and task-superiority inference.	RRM-009;LCAP-005;C-0046	Use one shared footnote; avoid repeating caveats in every caption.
LAPP-007	7	Prohibited-use note	manuscript/13-leaderboard-caption-use-note.md;data/leaderboard_final_caption_microcopy_i0054.tsv	Place after the chart-footnote pair as a compact "what this figure cannot prove" note.	Make false readings explicit before the appendix moves to price or benchmark material.	Keeps C-0046 active and blocks coding, safety, latency, enterprise, and best-model claims.	LCAP-008;C-0046;LMG-009;RRM-006;RRM-007	Use only if layout has space; otherwise fold into shared footnote.
LAPP-008	8	Price-quality handoff	data/price_quality_join_audit_i0036.tsv	If the appendix later moves to prices, insert a hard divider that says the historical rank chart is not a price-quality chart.	Prevent readers from mentally joining rank rows to provider prices.	Preserves C-0046 until same-scope price/rank joins are chart-ready.	C-0046;data/price_quality_join_audit_i0036.tsv	Add only when the price-quality section is drafted.
