pass_id	boundary_id	from_chapter	to_chapter	transition_text	reader_job	claim_guardrail	integration_status
I-0247	BOUNDARY-01	CH01	CH02	The public shock now turns into the older engineering problem: before a text box could feel conversational, language had to become something a machine could represent, compare, and predict.	handoff	No new factual claim beyond already sourced chapter-level scope; transition must connect mechanisms, not invent scenes or outcomes.	inserted_in_full_draft_as_i0247_stitch
I-0247	BOUNDARY-02	CH02	CH03	The bottleneck was not only that machines handled words badly; it was that sequence models struggled to move information cleanly across distance. Attention enters as the mechanism that lets the history of a sentence stay available.	handoff	No new factual claim beyond already sourced chapter-level scope; transition must connect mechanisms, not invent scenes or outcomes.	inserted_in_full_draft_as_i0247_stitch
I-0247	BOUNDARY-03	CH03	CH04	Once attention made sequence modeling more parallel and expressive, the next question became brutally empirical: what happens if the same architecture is made larger, fed more data, and measured without sentimentality?	handoff	No new factual claim beyond already sourced chapter-level scope; transition must connect mechanisms, not invent scenes or outcomes.	inserted_in_full_draft_as_i0247_stitch
I-0247	BOUNDARY-04	CH04	CH05	Scaling turned loss curves into strategy, but strategy still needed a vehicle. The GPT line made the wager concrete: pretrain a model broadly, then see how far prompting and access could carry it.	handoff	No new factual claim beyond already sourced chapter-level scope; transition must connect mechanisms, not invent scenes or outcomes.	inserted_in_full_draft_as_i0247_stitch
I-0247	BOUNDARY-05	CH05	CH06	The door opened by GPT-3 was powerful but unruly. If language models were going to become products, they needed more than continuation; they needed to behave like assistants under pressure from users, policies, and markets.	handoff	No new factual claim beyond already sourced chapter-level scope; transition must connect mechanisms, not invent scenes or outcomes.	inserted_in_full_draft_as_i0247_stitch
I-0247	BOUNDARY-06	CH06	CH07	Alignment work made the assistant shape possible, but ChatGPT tested that shape in public. The next chapter moves from training loop to interface event: what happened when the assistant became easy enough for anyone to try.	handoff	No new factual claim beyond already sourced chapter-level scope; transition must connect mechanisms, not invent scenes or outcomes.	inserted_in_full_draft_as_i0247_stitch
I-0247	BOUNDARY-07	CH07	CH08	The interface event created demand that no model paper could satisfy alone. To turn conversation into a durable product category, OpenAI needed cloud capacity, distribution, and institutional muscle.	handoff	No new factual claim beyond already sourced chapter-level scope; transition must connect mechanisms, not invent scenes or outcomes.	inserted_in_full_draft_as_i0247_stitch
I-0247	BOUNDARY-08	CH08	CH09	Microsoft's bargain showed one way to convert models into platform leverage. Google's problem was different: it already owned research depth, consumer habits, and infrastructure, and had to decide how quickly to move them together.	handoff	No new factual claim beyond already sourced chapter-level scope; transition must connect mechanisms, not invent scenes or outcomes.	inserted_in_full_draft_as_i0247_stitch
I-0247	BOUNDARY-09	CH09	CH10	Google's response kept the race inside the world of giant platforms; Meta changed the surface of the race by pushing powerful weights toward researchers, developers, and adopters outside a closed API lane.	handoff	No new factual claim beyond already sourced chapter-level scope; transition must connect mechanisms, not invent scenes or outcomes.	inserted_in_full_draft_as_i0247_stitch
I-0247	BOUNDARY-10	CH10	CH11	Open weights widened the field, but they did not make it simple. The next frontier was multipolar: Chinese labs, papers, repositories, and product surfaces made the race harder to reduce to a Western platform story.	handoff	No new factual claim beyond already sourced chapter-level scope; transition must connect mechanisms, not invent scenes or outcomes.	inserted_in_full_draft_as_i0247_stitch
I-0247	BOUNDARY-11	CH11	CH12	The frontier then spreads rather than narrows. Europe, xAI, Mistral, Anthropic, and other labs each complicate the idea that one geography, one license model, or one assistant philosophy owns the future.	handoff	No new factual claim beyond already sourced chapter-level scope; transition must connect mechanisms, not invent scenes or outcomes.	inserted_in_full_draft_as_i0247_stitch
I-0247	BOUNDARY-12	CH12	CH13	A crowded frontier creates a measurement hunger. Once readers have met many labs and model families, the book has to slow down and ask what a rank, benchmark, or arena score can honestly prove.	handoff	No new factual claim beyond already sourced chapter-level scope; transition must connect mechanisms, not invent scenes or outcomes.	inserted_in_full_draft_as_i0247_stitch
I-0247	BOUNDARY-13	CH13	CH14	The measurement chapter explains why model comparisons are unstable; the hardware chapter asks a deeper question underneath them: what kind of machine and software stack makes any of these comparisons possible?	handoff	No new factual claim beyond already sourced chapter-level scope; transition must connect mechanisms, not invent scenes or outcomes.	inserted_in_full_draft_as_i0247_stitch
I-0247	BOUNDARY-14	CH14	CH15	CUDA and GPUs are the hidden substrate; GTC is the theater where that substrate is sold back to the world as destiny. The next chapter treats NVIDIA's stagecraft as evidence of framing, not proof of fulfillment.	handoff	No new factual claim beyond already sourced chapter-level scope; transition must connect mechanisms, not invent scenes or outcomes.	inserted_in_full_draft_as_i0247_stitch
I-0247	BOUNDARY-15	CH15	CH16	The AI factory sounds abstract until it needs a site, a substation, cooling, transformers, and time. After the keynote, the book walks out of the convention hall and into the physical internet.	handoff	No new factual claim beyond already sourced chapter-level scope; transition must connect mechanisms, not invent scenes or outcomes.	inserted_in_full_draft_as_i0247_stitch
I-0247	BOUNDARY-16	CH16	CH17	Power is one input to the LLM machine; data is the other. Once the book has followed tokens to substations, it has to follow them backward into the libraries, crawls, filters, and tokenizers that feed training.	handoff	No new factual claim beyond already sourced chapter-level scope; transition must connect mechanisms, not invent scenes or outcomes.	inserted_in_full_draft_as_i0247_stitch
I-0247	BOUNDARY-17	CH17	CH18	Data gives a model memory-shaped material, but tools change what the model can do with a prompt. The next step is outward: retrieval, APIs, function calls, and action boundaries.	handoff	No new factual claim beyond already sourced chapter-level scope; transition must connect mechanisms, not invent scenes or outcomes.	inserted_in_full_draft_as_i0247_stitch
I-0247	BOUNDARY-18	CH18	CH19	General tool use shows the harness; code shows the first domain where language becomes executable and testable. The agent turn becomes sharper when the output must compile, run, and survive review.	handoff	No new factual claim beyond already sourced chapter-level scope; transition must connect mechanisms, not invent scenes or outcomes.	inserted_in_full_draft_as_i0247_stitch
I-0247	BOUNDARY-19	CH19	CH20	Code made the stakes measurable; Claude Code makes the workflow visible. The next chapter narrows from code as a second native language to repository work as a supervised industrial practice.	handoff	No new factual claim beyond already sourced chapter-level scope; transition must connect mechanisms, not invent scenes or outcomes.	inserted_in_full_draft_as_i0247_stitch
I-0247	BOUNDARY-20	CH20	CH21	Coding agents expose the cost of action, review, and retries. Reasoning systems expose a related cost inside inference itself: sometimes the machine spends more compute before it answers.	handoff	No new factual claim beyond already sourced chapter-level scope; transition must connect mechanisms, not invent scenes or outcomes.	inserted_in_full_draft_as_i0247_stitch
I-0247	BOUNDARY-21	CH21	CH22	If test-time compute becomes another scaling axis, then intelligence becomes not only a capability question but a pricing question. The next chapter turns the pause before an answer into a meter.	handoff	No new factual claim beyond already sourced chapter-level scope; transition must connect mechanisms, not invent scenes or outcomes.	inserted_in_full_draft_as_i0247_stitch
I-0247	BOUNDARY-22	CH22	CH23	Cheap fluency still has to be trusted. After the economics of tokens, the book turns to the failures that make every confident answer a claim needing context, provenance, and review.	handoff	No new factual claim beyond already sourced chapter-level scope; transition must connect mechanisms, not invent scenes or outcomes.	inserted_in_full_draft_as_i0247_stitch
I-0247	BOUNDARY-23	CH23	CH24	The trust chapter leaves the reader with no simple crown, cure, or prophecy. The final chapter returns to the next token as both mechanism and responsibility: what humans choose to ask, build, meter, and believe.	handoff	No new factual claim beyond already sourced chapter-level scope; transition must connect mechanisms, not invent scenes or outcomes.	inserted_in_full_draft_as_i0247_stitch
