rank	candidate_id	chapter	candidate_ref	candidate_type	title	source_basis	readiness	likely_top100	selection_reason	blocker_or_gate
001	EC-0188-001	1	A-0068	svg_diagram	opener chronology	Best current opener chronology because it pairs shock with blocked metric lanes.	ready_svg	yes	Selected in I-0182 master matrix	Render in full-book opener spread.
002	EC-0188-002	1	A-0069	svg_diagram	mechanism bridge	Keeps the chat box tied to next-token mechanics before company drama.	ready_svg	yes	Selected in I-0182 master matrix	Check mobile/print legibility.
003	EC-0188-003	1	A-0070	svg_diagram	local response texture	Shows institutional reaction without broad public-panic overclaiming.	ready_svg	yes	Selected in I-0182 master matrix	Keep only if prose placement stays tight.
004	EC-0188-004	2	A-0115	svg_diagram	pre-Transformer pressure chain	Fills the Chapter 2 mechanism gap with a constraint map.	ready_svg	yes	Selected in I-0182 master matrix	Trace final caption to paper-source rows.
005	EC-0188-005	3	A-0116	svg_diagram	self-attention mechanism	Fills the Chapter 3 architecture gap with a non-mystical attention schematic.	ready_svg	yes	Selected in I-0182 master matrix	Add exact Transformer-figure provenance before final art.
006	EC-0188-006	4	A-0117	svg_diagram	scaling evidence lanes	Fills Chapter 4 with a permissioned curve grammar rather than prophecy.	ready_svg	yes	Selected in I-0182 master matrix	Verify plotted-value exclusions in final caption.
007	EC-0188-007	5	A-0010	svg_diagram	GPT lineage anchor	Compactly connects GPT-1/GPT-2/GPT-3/API/Codex/Copilot.	ready_svg	yes	Selected in I-0182 master matrix	Check against Chapter 19 overlap.
008	EC-0188-008	6	A-0011	svg_diagram	alignment mechanism	Strongest RLHF/alignment pipeline visual already in house style.	ready_svg	yes	Selected in I-0182 master matrix	Pair with one source surface, not more diagrams.
009	EC-0188-009	6	A-0121	screenshot_slot	ChatGPT product surface	Product texture for assistant behavior becoming a public interface.	private_capture_needed	yes	Selected in I-0182 master matrix	Capture screenshot/hash; rights review.
010	EC-0188-010	6	A-0122	screenshot_slot	Plus productization surface	Shows subscription packaging without revenue or adoption inference.	private_capture_needed	yes	Selected in I-0182 master matrix	Capture screenshot/hash; strict caption.
011	EC-0188-011	7	A-0016	svg_diagram	ChatGPT business timeline	Best safe chronology for interface-to-business conversion.	ready_svg	yes	Selected in I-0182 master matrix	Retain blocked adoption lane.
012	EC-0188-012	7	A-0036	screenshot_slot	ChatGPT launch surface	High reader-recognition value for the interface event.	private_capture_needed	yes	Selected in I-0182 master matrix	Capture/hash or use archival fallback.
013	EC-0188-013	7	A-0037	screenshot_slot	ChatGPT Plus surface	Useful paid-product bridge if it does not duplicate A-0122.	private_capture_needed	yes	Selected in I-0182 master matrix	Choose one of A-0037/A-0122 in final layout.
014	EC-0188-014	7	A-0038	screenshot_slot	Enterprise surface	Enterprise controls surface for work-product chapter handoff.	private_capture_needed	yes	Selected in I-0182 master matrix	Capture/hash; block productivity and customer outcomes.
015	EC-0188-015	7	A-0039	screenshot_slot	plugins surface	Tool-use bridge from ChatGPT chapter to agent chapters.	private_capture_needed	yes	Selected in I-0182 master matrix	Capture/hash; block ecosystem adoption.
016	EC-0188-016	8	A-0056	svg_diagram	cloud bargain timeline	Best Microsoft/OpenAI capacity-distribution-governance diagram.	ready_svg	yes	Selected in I-0182 master matrix	Check if chapter can carry four diagrams.
017	EC-0188-017	8	A-0057	svg_diagram	cloud-to-product flywheel	Shows Azure/product distribution bargain without revenue claims.	ready_svg	yes	Selected in I-0182 master matrix	Prune if it duplicates A-0056 in layout.
018	EC-0188-018	8	A-0058	svg_diagram	inference cost stack	Explains hidden cost behind work surfaces.	ready_svg	yes	Selected in I-0182 master matrix	Keep for economics handoff.
019	EC-0188-019	8	A-0059	svg_diagram	enterprise blocker map	Keeps enterprise claims honest.	ready_svg	yes	Selected in I-0182 master matrix	May become appendix/sidebar if chapter feels over-diagrammed.
020	EC-0188-020	9	A-0086	svg_diagram	Google conversion timeline	Best Google/DeepMind conversion-pressure anchor.	ready_svg	yes	Selected in I-0182 master matrix	Keep benchmark/adoption blockers visible.
021	EC-0188-021	9	A-0087	svg_diagram	Gemini surface conversion	Explains Google distribution pressure without caricature.	ready_svg	yes	Selected in I-0182 master matrix	Check overlap with A-0086.
022	EC-0188-022	9	A-0088	svg_diagram	long-context product grammar	Adds technical/product distinction for Gemini long context.	ready_svg	yes	Selected in I-0182 master matrix	Verify exact source rows before final caption.
023	EC-0188-023	9	A-0089	svg_diagram	Gemini claim blockers	Keeps search, adoption, and benchmark inferences separate.	ready_svg	yes	Selected in I-0182 master matrix	Use if prose makes tempting claims nearby.
024	EC-0188-024	9	A-0129	screenshot_slot	Gemini/Bard source surface	Product texture that diagrams cannot provide.	private_capture_needed	yes	Selected in I-0182 master matrix	Capture/hash; block Search-share and productivity claims.
025	EC-0188-025	10	A-0030	svg_diagram	Llama family map	Core Chapter 10 open-weight chronology visual.	ready_svg	yes	Selected in I-0182 master matrix	Check current license-state caveats.
026	EC-0188-026	10	A-0112	svg_diagram	open-weight control stack	Separates weights, license, hosting, safety, and ecosystem burdens.	ready_svg	yes	Selected in I-0182 master matrix	Prioritize over duplicate Llama screenshots.
027	EC-0188-027	10	A-0113	svg_diagram	adopter burden transfer	Explains why openness moves responsibility outward.	ready_svg	yes	Selected in I-0182 master matrix	Use with Chapter 10 prose, not as generic open-source claim.
028	EC-0188-028	10	A-0044	screenshot_slot	LLaMA launch surface	Primary-source product/release texture for the open-weight shock.	private_capture_needed	yes	Selected in I-0182 master matrix	Capture/hash; block adoption.
029	EC-0188-029	10	A-0047	screenshot_slot	Llama repository surface	Developer-artifact texture beyond press pages.	private_capture_needed	yes	Selected in I-0182 master matrix	Capture/hash; mutable repo numbers blocked.
030	EC-0188-030	11	A-0031	svg_diagram	China source-permission map	Core source-lane guardrail for Chinese/open models.	ready_svg	yes	Selected in I-0182 master matrix	Update if later Qwen/DeepSeek sources mature.
031	EC-0188-031	11	A-0118	svg_diagram	supported-vs-gap board	Prevents logo parade and unsupported family claims.	ready_svg	yes	Selected in I-0182 master matrix	Keep as chapter control surface.
032	EC-0188-032	11	A-0048	source_screenshot_slot	Qwen2 source surface	Primary-paper texture for supported Qwen lane.	private_capture_needed	yes	Selected in I-0182 master matrix	Capture/hash; do not rank.
033	EC-0188-033	11	A-0049	source_screenshot_slot	Qwen3 source surface	Supported cutoff-bounded Qwen source surface.	private_capture_needed	yes	Selected in I-0182 master matrix	Capture/hash; Qwen 3.5/3.6 remains blocked.
034	EC-0188-034	11	A-0050	source_screenshot_slot	DeepSeek-R1 source surface	Bridge to reasoning chapter with source texture.	private_capture_needed	yes	Selected in I-0182 master matrix	Capture/hash; benchmark extraction separate.
035	EC-0188-035	12	A-0094	svg_diagram	Constitutional AI behavior grammar	Best behavior-spec visual for Anthropic chapter.	ready_svg	yes	Selected in I-0182 master matrix	Confirm Chapter 12 title/placement.
036	EC-0188-036	12	A-0095	svg_diagram	Claude product family	Maps Claude product family without benchmark crown.	ready_svg	yes	Selected in I-0182 master matrix	Check overlap with A-0130.
037	EC-0188-037	12	A-0096	svg_diagram	assistant-to-action surface	Bridge from behavior to action surfaces.	ready_svg	yes	Selected in I-0182 master matrix	Pair with source screenshot only once.
038	EC-0188-038	12	A-0097	svg_diagram	Claude claim blockers	Keeps safety and adoption claims fenced.	ready_svg	yes	Selected in I-0182 master matrix	Use near prose with safety temptation.
039	EC-0188-039	12	A-0119	screenshot_slot	computer-use source surface	Important action-surface source texture.	private_capture_needed	yes	Selected in I-0182 master matrix	Capture/hash; block autonomy.
040	EC-0188-040	12	A-0130	screenshot_slot	Claude product source surface	Product texture for Claude as assistant family.	private_capture_needed	yes	Selected in I-0182 master matrix	Capture/hash; block safety success.
041	EC-0188-041	13	A-0014	svg_diagram	leaderboard methodology	Essential before any ranking visual.	ready_svg	yes	Selected in I-0182 master matrix	Keep before A-0013 in reading order.
042	EC-0188-042	13	A-0013	svg_chart	historical leaderboard slice	Useful only after methodology guardrails.	ready_svg	yes	Selected in I-0182 master matrix	No live rank; snapshot caption required.
043	EC-0188-043	13	A-0019	svg_diagram	price-quality exclusion map	Shows why price-quality frontier is blocked.	ready_svg	yes	Selected in I-0182 master matrix	Keep if economics chapter does not repeat it.
044	EC-0188-044	14	A-0071	svg_diagram	CUDA stack	Core NVIDIA/CUDA moat visual.	ready_svg	yes	Selected in I-0182 master matrix	Do not broaden into all semiconductor history.
045	EC-0188-045	14	A-0072	svg_diagram	GPU memory/interconnect	Explains traffic problem behind accelerators.	ready_svg	yes	Selected in I-0182 master matrix	Verify legibility at book trim.
046	EC-0188-046	14	A-0073	svg_diagram	training-vs-inference capacity	Sets up Chapter 15/16 split.	ready_svg	yes	Selected in I-0182 master matrix	Keep if not redundant with GTC slides.
047	EC-0188-047	14	A-0133	photo_candidate_slot	lithography/ASML proxy	Industrial texture for chipmaking constraints, with specificity caveat.	rights_review_needed	yes	Selected in I-0182 master matrix	Find stronger ASML-machine photo or caption as proxy.
048	EC-0188-048	14	A-0134	photo_candidate_slot	cleanroom photo	Credible physical manufacturing texture.	rights_review_needed	yes	Selected in I-0182 master matrix	Verify exact license and attribution.
049	EC-0188-049	14	A-0136	photo_candidate_slot	server rack photo	Compute infrastructure texture for hardware chapter.	rights_review_needed	yes	Selected in I-0182 master matrix	Verify license; block named workload.
050	EC-0188-050	15	A-0012	svg_diagram	AI factory stack	Best neutral explainer separating NVIDIA rhetoric from infrastructure layers.	ready_svg	yes	Selected in I-0182 master matrix	Anchor before GTC source surfaces.
051	EC-0188-051	15	A-0024	svg_claim_card	GTC AI-factory thesis card	Page-provenance claim card for GTC thesis.	ready_svg	yes	Selected in I-0182 master matrix	Choose card or slide render, not both if crowded.
052	EC-0188-052	15	A-0027	svg_claim_card	GTC system comparison card	Useful as rhetoric/economics stagecraft, not independent proof.	ready_svg	yes	Selected in I-0182 master matrix	Keep caption narrow.
053	EC-0188-053	15	A-0028	svg_claim_card	GTC roadmap cadence card	Shows roadmap sequencing as source rhetoric.	ready_svg	yes	Selected in I-0182 master matrix	Block delivery/performance claims.
054	EC-0188-054	15	A-0029	svg_claim_card	GTC DSX platform card	Bridge from GTC story to physical constraints.	ready_svg	yes	Selected in I-0182 master matrix	Pair with Chapter 16 handoff.
055	EC-0188-055	15	A-0004	extracted_slide_render	GTC page 29 slide render	High visual drama if rights/fair-use review passes.	local_ignored_hash_available	yes	Selected in I-0182 master matrix	Choose against A-0024; avoid duplication.
056	EC-0188-056	15	A-0106	source_screenshot_slot	page 29 hashed source surface	Provenance-ready GTC source surface.	local_ignored_hash_available	yes	Selected in I-0182 master matrix	Use as private evidence handle or final source surface after rights review.
057	EC-0188-057	16	A-0015	svg_diagram	power-to-token flow	Core Chapter 16 mechanism visual.	ready_svg	yes	Selected in I-0182 master matrix	Keep as physical-internet spine.
058	EC-0188-058	16	A-0020	svg_diagram	load scenarios	Best measured/scenario separation for demand.	ready_svg	yes	Selected in I-0182 master matrix	Ensure forecasts stay labeled.
059	EC-0188-059	16	A-0021	svg_diagram	interconnection queue	Shows timing bottleneck without project database overclaim.	ready_svg	yes	Selected in I-0182 master matrix	Pair with physical grid photo if possible.
060	EC-0188-060	16	A-0022	svg_diagram	cooling/rack-density note	Explains cooling constraint without engineering overreach.	ready_svg	yes	Selected in I-0182 master matrix	Consider replacing with photo if layout is diagram-heavy.
061	EC-0188-061	16	A-0023	svg_diagram	clean procurement vs physical supply	Important claim-control visual for power sourcing.	ready_svg	yes	Selected in I-0182 master matrix	Keep near PPA/clean-power prose.
062	EC-0188-062	16	A-0137	photo_candidate_slot	data-center hall photo	Needed real-world texture for compute rooms.	rights_review_needed	yes	Selected in I-0182 master matrix	Verify original license trail.
063	EC-0188-063	16	A-0139	photo_candidate_slot	substation photo	Physical grid texture for interconnection prose.	rights_review_needed	yes	Selected in I-0182 master matrix	Verify license; no site-service claim.
064	EC-0188-064	16	A-0141	photo_candidate_slot	gas turbine photo	Shows speed-to-power equipment without deployment claim.	rights_review_needed	yes	Selected in I-0182 master matrix	Verify license and caption as generic.
065	EC-0188-065	16	A-0143	photo_candidate_slot	nuclear/cooling tower photo	Power-supply debate texture without delivered-power claim.	rights_review_needed	yes	Selected in I-0182 master matrix	Verify license and attribution.
066	EC-0188-066	17	A-0064	svg_diagram	tokenization ladder	Core data chapter mechanism visual.	ready_svg	yes	Selected in I-0182 master matrix	Verify tokenizer caveats stay visible.
067	EC-0188-067	17	A-0065	svg_diagram	web-corpus filter funnel	Best data supply-chain process visual.	ready_svg	yes	Selected in I-0182 master matrix	Block closed-corpus composition claims.
068	EC-0188-068	17	A-0066	svg_diagram	data mixture control board	Shows hidden mixtures and controls.	ready_svg	yes	Selected in I-0182 master matrix	Keep schematic, not measured shares.
069	EC-0188-069	17	A-0067	svg_diagram	memorization blocker map	Useful trust/data caveat visual.	ready_svg	yes	Selected in I-0182 master matrix	Keep prevalence claims blocked.
070	EC-0188-070	18	A-0060	svg_diagram	RAG evidence conveyor	Core tools/retrieval mechanism.	ready_svg	yes	Selected in I-0182 master matrix	Do not duplicate trust chapter.
071	EC-0188-071	18	A-0061	svg_diagram	function-call boundary	Best tool-permission schematic.	ready_svg	yes	Selected in I-0182 master matrix	Pair with API docs screenshot.
072	EC-0188-072	18	A-0062	svg_diagram	agent loop as harness	General agent loop before coding specificity.	ready_svg	yes	Selected in I-0182 master matrix	Keep distinct from Chapter 20.
073	EC-0188-073	18	A-0063	svg_diagram	prompt-injection boundary	Safety/trust bridge for tool use.	ready_svg	yes	Selected in I-0182 master matrix	Keep near untrusted-retrieval prose.
074	EC-0188-074	18	A-0124	screenshot_slot	ChatGPT tools/GPTs surface	Product texture for tool turn.	private_capture_needed	yes	Selected in I-0182 master matrix	Capture/hash; block adoption.
075	EC-0188-075	19	A-0090	svg_diagram	code as language	Core Chapter 19 coding thesis visual.	ready_svg	yes	Selected in I-0182 master matrix	Check density with prose.
076	EC-0188-076	19	A-0091	svg_diagram	assistant at cursor	Shows product placement in the IDE/workflow.	ready_svg	yes	Selected in I-0182 master matrix	Pair with one screenshot only.
077	EC-0188-077	19	A-0092	svg_diagram	coding score harness	Benchmark context for code systems.	ready_svg	yes	Selected in I-0182 master matrix	Do not repeat Chapter 20 matrix.
078	EC-0188-078	19	A-0093	svg_diagram	repository as prompt	Strong workflow bridge into Chapter 20.	ready_svg	yes	Selected in I-0182 master matrix	Keep as chapter-ending setup.
079	EC-0188-079	19	A-0127	screenshot_slot	GitHub Copilot surface	Reader-recognition product surface.	private_capture_needed	yes	Selected in I-0182 master matrix	Capture/hash; block productivity.
080	EC-0188-080	20	A-0032	svg_diagram	coding-agent harness loop	Core Chapter 20 workflow figure.	ready_svg	yes	Selected in I-0182 master matrix	Keep human review boundary.
081	EC-0188-081	20	A-0033	svg_diagram	coding benchmark caveat matrix	Stops benchmark-to-productivity laundering.	ready_svg	yes	Selected in I-0182 master matrix	Keep near benchmark prose.
082	EC-0188-082	20	A-0034	svg_diagram	tool-call lifecycle	Shows permission boundary in coding agent work.	ready_svg	yes	Selected in I-0182 master matrix	Pair with Claude Code docs.
083	EC-0188-083	20	A-0035	svg_diagram	productivity blocker map	Keeps business claims blocked.	ready_svg	yes	Selected in I-0182 master matrix	Use if chapter has vendor-product claims.
084	EC-0188-084	20	A-0131	screenshot_slot	Claude Code surface	Product/docs texture for repository agent.	private_capture_needed	yes	Selected in I-0182 master matrix	Capture/hash; block autonomy.
085	EC-0188-085	21	A-0078	svg_diagram	reasoning compute axis	Core test-time compute visual.	ready_svg	yes	Selected in I-0182 master matrix	Keep train-time vs answer-time distinction.
086	EC-0188-086	21	A-0079	svg_diagram	reasoning loop	Explains loops without hidden-thought mysticism.	ready_svg	yes	Selected in I-0182 master matrix	Caption must block truth guarantees.
087	EC-0188-087	21	A-0080	svg_diagram	inference contract	Essential for reasoning benchmark claims.	ready_svg	yes	Selected in I-0182 master matrix	Use before benchmark mentions.
088	EC-0188-088	21	A-0081	svg_diagram	thinking cost tradeoff	Connects reasoning to economics.	ready_svg	yes	Selected in I-0182 master matrix	Keep value claims blocked.
089	EC-0188-089	22	A-0082	svg_diagram	visible meter	Core economics chapter anchor.	ready_svg	yes	Selected in I-0182 master matrix	Verify price/currentness caveats.
090	EC-0188-090	22	A-0083	svg_diagram	routing/caching/batching/distillation	Best cost-control mechanism map.	ready_svg	yes	Selected in I-0182 master matrix	Keep distinct from Chapter 8 cost stack.
091	EC-0188-091	22	A-0084	svg_diagram	business models	Shows monetization routes without revenue proof.	ready_svg	yes	Selected in I-0182 master matrix	Caption blocks margin and ARR claims.
092	EC-0188-092	22	A-0085	svg_diagram	economics claim blockers	Keeps price, margin, value claims fenced.	ready_svg	yes	Selected in I-0182 master matrix	Use as sidebar if layout is dense.
093	EC-0188-093	23	A-0074	svg_diagram	failure modes separation	Core trust chapter taxonomy.	ready_svg	yes	Selected in I-0182 master matrix	Prevent incident montage.
094	EC-0188-094	23	A-0075	svg_diagram	trust stack	Best whole-stack trust visual.	ready_svg	yes	Selected in I-0182 master matrix	Check if final chapter repeats it.
095	EC-0188-095	23	A-0076	svg_diagram	evaluation shadow	Connects eval design to blind spots.	ready_svg	yes	Selected in I-0182 master matrix	Use with benchmark chapters cross-reference.
096	EC-0188-096	23	A-0077	svg_diagram	auditable claim loop	Shows evidence trace into human judgment.	ready_svg	yes	Selected in I-0182 master matrix	Pair with source-density prose.
097	EC-0188-097	24	A-0108	svg_diagram	next-token system map	Final synthesis anchor.	ready_svg	yes	Selected in I-0182 master matrix	Keep from becoming generic summary wallpaper.
098	EC-0188-098	24	A-0109	svg_diagram	five conversion gates	Strong closing structure visual.	ready_svg	yes	Selected in I-0182 master matrix	Use if final prose follows conversion motif.
099	EC-0188-099	24	A-0110	svg_diagram	unsettled claims board	Honest unresolved-claims ending.	ready_svg	yes	Selected in I-0182 master matrix	Keep if not too apparatus-heavy.
100	EC-0188-100	24	A-0111	svg_diagram	human judgment loop	Best final human-boundary image.	ready_svg	yes	Selected in I-0182 master matrix	Use as closing visual if layout has room.
101	EC-0188-101	multi	A-0001	svg_diagram	Chronology rail prototype for launch, model, hardware, and cutoff-bounded timeline figures.	manuscript/00-visual-grammar.md	available	no	Reserve manifest row outside I-0182 top 100	Original lightweight SVG generated for this private manuscript workspace.
102	EC-0188-102	multi	A-0002	svg_diagram	Repository task lifecycle prototype for coding-agent and tool-use workflow figures.	manuscript/00-visual-grammar.md	available	no	Reserve manifest row outside I-0182 top 100	Original lightweight SVG generated for this private manuscript workspace.
103	EC-0188-103	multi	A-0003	svg_diagram	Tradeoff curve prototype for scaling, price-performance, latency-cost, and benchmark caveat figures.	manuscript/00-visual-grammar.md	available	no	Reserve manifest row outside I-0182 top 100	Original lightweight SVG generated for this private manuscript workspace.
104	EC-0188-104	multi	A-0005	extracted_slide_render	Figure 15.x - GTC 2026 slide for NVIDIA Groq 3 LPX inference compute, including NVIDIA-stated specs and Available 2H26.	manuscript/15-gtc-2026-source-pack.md	available_local_ignored	no	Reserve manifest row outside I-0182 top 100	Private-use local render from GTC-2026-Keynote.pdf; PNG is ignored and not committed; hash and dimensions in data/gtc_2026_rendered_pages.tsv; final caption and caveat in data/gtc_2026_slide_captions.tsv.
105	EC-0188-105	multi	A-0006	extracted_slide_render	Figure 15.x - NVIDIA announces Vera Rubin NVL72 launch partners with NVIDIA-stated perf-per-watt, NVFP4, HBM4, and NVLink6 claims.	manuscript/15-gtc-2026-source-pack.md	available_local_ignored	no	Reserve manifest row outside I-0182 top 100	Private-use local render from GTC-2026-Keynote.pdf; PNG is ignored and not committed; hash and dimensions in data/gtc_2026_rendered_pages.tsv; final caption and caveat in data/gtc_2026_slide_captions.tsv.
106	EC-0188-106	multi	A-0007	extracted_slide_render	Figure 15.x - NVIDIA compares a one-gigawatt X86-plus-Hopper AI factory with a Vera Rubin system across GPUs, FLOPS, bandwidth, and tokens per second.	manuscript/15-gtc-2026-source-pack.md	available_local_ignored	no	Reserve manifest row outside I-0182 top 100	Private-use local render from GTC-2026-Keynote.pdf; PNG is ignored and not committed; hash and dimensions in data/gtc_2026_rendered_pages.tsv; final caption and caveat in data/gtc_2026_slide_captions.tsv.
107	EC-0188-107	multi	A-0008	extracted_slide_render	Figure 15.x - NVIDIA's 2024-2026-2028 roadmap links Blackwell, Rubin, Feynman, Vera, BlueField, Spectrum, ConnectX, NVLink, and rack-scale systems.	manuscript/15-gtc-2026-source-pack.md	available_local_ignored	no	Reserve manifest row outside I-0182 top 100	Private-use local render from GTC-2026-Keynote.pdf; PNG is ignored and not committed; hash and dimensions in data/gtc_2026_rendered_pages.tsv; final caption and caveat in data/gtc_2026_slide_captions.tsv.
108	EC-0188-108	multi	A-0009	extracted_slide_render	Figure 15.x - NVIDIA presents DSX as an AI Factory Platform spanning chips, systems, facilities, software, reference designs, simulation, cooling, and power.	manuscript/15-gtc-2026-source-pack.md	available_local_ignored	no	Reserve manifest row outside I-0182 top 100	Private-use local render from GTC-2026-Keynote.pdf; PNG is ignored and not committed; hash and dimensions in data/gtc_2026_rendered_pages.tsv; final caption and caveat in data/gtc_2026_slide_captions.tsv.
109	EC-0188-109	multi	A-0017	svg_layout_mock	Figure 16.x - N16-1 Note Layout Mock. Single-page mock testing whether the LBNL/DOE paragraph can move CH16Q-003 through CH16Q-006 into a same-page note while CH16Q-017 and CH16Q-018 remain inline.	manuscript/16-note-layout-mock.md	available	no	Reserve manifest row outside I-0182 top 100	Original lightweight SVG generated from data/chapter16_note_layout_mock_i0063.tsv and checked against data/chapter16_note_layout_acceptance_i0063.tsv; no external image assets; C-0021/C-0047 remain active.
110	EC-0188-110	multi	A-0018	svg_layout_mock	Figure 16.x - Parent Inline-Cue Render. Lightweight page render showing the current LBNL/DOE paragraph before any N16-1 note move, with CH16Q-003 through CH16Q-006 still inline.	manuscript/16-n16-1-render-comparison.md	available	no	Reserve manifest row outside I-0182 top 100	Original lightweight SVG generated for this private manuscript workspace; no external image assets; not a production PDF screenshot.
111	EC-0188-111	multi	A-0025	svg_claim_card	Figure 15.x - GTC Page 45: Inference Compute Roadmap. Lightweight card labeling Groq 3 LPX and 2H26 availability language as NVIDIA roadmap/availability/performance evidence.	manuscript/15-gtc-2026-visual-source-pack-i0101.md	available	no	Reserve manifest row outside I-0182 top 100	Original lightweight SVG derived from GTC-2026-Keynote.pdf page 45 notes and A-0005 caption row; no external image assets; C-0047 remains active.
112	EC-0188-112	multi	A-0026	svg_claim_card	Figure 15.x - GTC Page 46: Vera Rubin NVL72. Lightweight card labeling launch-partner and rack-scale performance statements as NVIDIA announcement, partner, and performance claims.	manuscript/15-gtc-2026-visual-source-pack-i0101.md	available	no	Reserve manifest row outside I-0182 top 100	Original lightweight SVG derived from GTC-2026-Keynote.pdf page 46 notes and A-0006 caption row; no external image assets; C-0047 remains active.
113	EC-0188-113	multi	A-0040	screenshot_slot	Figure 12/20.x - Claude 4 launch surface. Private-use screenshot slot for model-line and benchmark-permission discussion.	manuscript/00-non-nvidia-visual-photo-acquisition-i0112.md	acquisition_ready	no	Reserve manifest row outside I-0182 top 100	Private-use acquisition slot only; do not commit raster; benchmark numbers need row extraction.
