action_id	priority	scope	rhythm_issue	action	acceptance_check	blocked_until_done
I0215-ACT-001	P0	Chapters 2-5	under_varied_low_count	The early mechanism chapters need one additional source-texture or scene beat each only when rights/provenance are ready.	Final layout does not present Chapters 2-5 as four consecutive lone diagrams without nearby source-card, paper-surface, or prose scene relief.	Early technical sequence may feel like a schematic appendix instead of a pressure chain.
I0215-ACT-002	P0	Chapter 7	source_texture_cluster	Five product/source-texture beats need stronger mechanism/evidence caption alternation.	At least two Chapter 7 product/interface surfaces are separated by prose, mechanism, or evidence-control captions in the final spread plan.	ChatGPT product visuals may look like a brand/product montage or imply adoption/business outcomes.
I0215-ACT-003	P1	Chapter 13	comparison_cluster	Model-ranking visuals should not appear as three consecutive comparison tables/matrices.	One Chapter 13 comparison figure is reserved or separated by methodology prose and a caveat footnote before final placement.	Readers may treat rank/price visuals as live crowns or price-quality proof.
I0215-ACT-004	P0	Chapter 16	source_texture_cluster	Physical/source imagery must alternate with synthesis diagrams and independent constraint framing.	Chapter 16 final placement interleaves photos/source surfaces with power/cooling/interconnection mechanism visuals.	Industrial texture may imply capacity, delivered power, site workload, emissions, or facility performance.
I0215-ACT-005	P1	Chapter 17	diagram_mechanism_run	Add source texture or scene framing only after corpus/source-card quote limits are ready.	Chapter 17 final plan has one concrete source/corpus surface or prose scene adjacent to token/corpus/mixture diagrams.	Data chapter may remain accurate but visually dry.
I0215-ACT-006	P1	Chapters 21-24	diagram_mechanism_run	Late-book mechanism runs should be broken by one source texture or human judgment beat per chapter group.	At least one late-book source surface, scene, or human-facing visual interrupts the mechanism sequence before the finale closes.	The ending may feel like a dashboard sequence instead of narrative pressure.
I0215-ACT-007	P0	Whole book	experience_mix_balance	Preserve the current global mix while reducing local repetition: 39 mechanism, 25 source texture, 15 comparison, 11 evidence, 10 scene.	No final chapter spread contains three same-class exhibits in a row unless a manuscript note justifies the rhythm.	Visual abundance may still read as monotony.
I0215-ACT-008	P0	Render QA	production_gate	Treat rhythm flags as pre-render gates, not immediate asset promotions.	Final PDF QA checks exhibit order, page breaks, class alternation, caption density, and blocker visibility before claiming publication readiness.	A selected-100 count may masquerade as designed visual pacing.
